近 鉄塔 (Near Railway Tower) : 3,棒 球场 (Baseball field) : 0,棒 日航 (Great Nikko) : 0,日式 房 (Japanese style room) : 0,干净 风格 (Clean style) : 0,大 满足 (Big satisfaction) : 2,日式 餐厅 (Japanese restaurant) : 0
近 離地鐵站 (Close to the subway station) : 3,棒 用品 (Great supplies) : 0,棒 早餐 (Great breakfast) : 0,日式 房间 (Japanese style room) : 0,干净 饭店 (Clean restaurant) : 0,大 灰 (Big gray) : 2,日式 餐馆 (Japanese restaurant) : 0
远 中心 (Far center) : 3,棒 真 (Awesome really) : 0,棒 早饭 (Great breakfast) : 0,日式 按摩 (Japanese massage) : 0,庭院 (patio) : 0,大 热天 (Big hot day) : 2,日式 饭店 (Japanese restaurant) : 0
远 交通 (Far traffic) : 3,棒 硬件 (Great hardware) : 0,棒 晚餐 (Great dinner) : 0,日式 料理 (Japanese cuisine) : 0,快捷 便利 (Fast and convenient) : 0,大 热水 (Big hot water) : 2,棒 下面 (Great below) : 0
远 出口 (Far exit) : 3,棒 管理 (Great management) : 0,棒 景 (Great view) : 0,日式 旅馆 (Ryokan) : 0,意外 好吃 (Unexpectedly delicious) : 0,大 版 (Large version) : 2,棒 业 (Great industry) : 0
远 周围 (Far around) : 3,棒 细节 (Great details) : 0,棒 景色 (Great scenery) : 0,日式 早饭 (Japanese breakfast) : 0,新 .... (New...) : 0,大 玻璃窗 (Large glass windows) : 2,棒 中文 (Great in Chinese) : 0
远 场 (Far field) : 3,棒 美景 (Great views) : 0,棒 景观 (Great landscape) : 0,日式 标准 (Japanese standard) : 0,新 东西 (New thing) : 0,大 用品 (Big supplies) : 2,棒 主要 (Great main) : 0
远 旁边 (Far side) : 3,棒 美食 (Great gourmet) : 0,棒 服务 (Great service) : 0,日式 榻榻米 (Japanese style tatami) : 0,新 中心 (New center) : 0,大 电梯 (Big elevator) : 2,棒 交通 (Great traffic) : 0
远 服务 (Far service) : 3,棒 自助餐 (Great buffet) : 0,棒 服务员 (Great waiter) : 0,日式 欧式 (Japanese style) : 0,新 主楼 (New main building) : 0,大 盒子 (Big box) : 2,棒 享受 (Great enjoy) : 0
远 购物 (Far shopping) : 3,棒 花园 (Great garden) : 0,棒 服务生 (Great waiter) : 0,日式 浴 (Japanese bath) : 0,新 价 (New price) : 0,大 福音 (Great gospel) : 2,棒 人 (Great man) : 0
远 通 (Far pass) : 3,棒 英文 (Great English) : 0,棒 条件 (Great condition) : 0,日式 浴场 (Japanese style bath) : 0,新 位置 (New location) : 0,大 站点 (Big site) : 2,棒 人员 (Staff) : 0
远 门口 (Far doorway) : 3,棒 英语 (Great English) : 0,棒 棒 (Great Great) : 0,日式 浴室 (Japanese style bathroom) : 0,新 体验 (New Experience) : 0,大 纸 (Large paper) : 2,棒 价位 (Great price) : 0
远 马路 (Far road) : 3,棒 茶 (Great tea) : 0,棒 楼下 (Great downstairs) : 0,日式 浴衣 (Japanese Yukata) : 0,新 利 (Xinli) : 0,大 美食 (Great gourmet) : 2,棒 价格 (Great price) : 0
一流 水准 (First-class level) : 2,棒 菜品 (Great dishes) : 0,棒 水平 (Great level) : 0,日式 温泉 (Japanese hot spring) : 0,新 区 (New District) : 0,大 花园 (Big garden) : 2,棒 便利 (Great convenience) : 0
一流 海景 (Superb sea view) : 2,棒 虾 (Great shrimp) : 0,棒 水果 (Great fruit) : 0,日式 澡堂 (Japanese style bathhouse) : 0,新 去 (New go) : 0,大 药妆店 (Big drugstore) : 2,棒 出行 (Great trip) : 0
一流 软件 (First-class software) : 2,棒 街 (Great street) : 0,棒 沙滩 (Great beach) : 0,日式 火锅 (Japanese hot pot) : 0,新 商务区 (New business district) : 0,大 落地窗 (Large French windows) : 2,棒 前台 (Front desk) : 0
一般 东 (General east) : 2,棒 装修 (Great decoration) : 0,棒 泳池 (Great pool) : 0,日式 种类 (Japanese style) : 0,新 商场 (New mall) : 0,大 蟑螂 (Big cockroach) : 2,棒 午餐 (Great lunch) : 0
一般 住宿 (General accommodation) : 2,棒 视野 (Great) : 0,棒 洗衣机 (Great washing machine) : 0,日式 窗户 (Japanese style window) : 0,新 地方 (New place) : 0,大 被子 (Big quilt) : 2,棒 卫生 (Great hygiene) : 0
一般 印象 (General impression) : 2,棒 设备 (Great equipment) : 0,棒 浴场 (Great bath) : 0,日式 结合 (Japanese style) : 0,新 地铁 (New subway) : 0,大 装修 (Large decoration) : 2,棒 卫生间 (Great toilet) : 0
一般 口感 (General taste) : 2,棒 设施 (Great facilities) : 0,棒 浴室 (Great bathroom) : 0,日式 自助餐 (Japanese buffet) : 0,新 坂 (Shin Saka) : 0,大 败笔 (Big failure) : 2,棒 口味 (Great taste) : 0
一般 周围 (General vicinity) : 2,棒 设计 (Great design) : 0,棒 海景 (Great sea view) : 0,日式 花园 (Japanese garden) : 0,新 大堂 (New lobby) : 0,大 部队 (Large forces) : 2,棒 周边 (Great surroundings) : 0
一般 品质 (General quality) : 2,棒 超市 (Great supermarket) : 0,棒 海滩 (Great beach) : 0,日式 英文 (Japanese English) : 0,新 大楼 (New building) : 0,大 采购 (Big purchase) : 2,棒 味道 (Great taste) : 0
一般 地方 (General place) : 2,棒 软件 (Great software) : 0,棒 温泉 (Great hot spring) : 0,日式 英语 (Japanese English) : 0,新 宿ビ (Shinjuku ビ) : 0,大 金 (Big gold) : 2,棒 咖啡 (Great coffee) : 0
一般 大厅 (General lobby) : 2,棒 酒店 (Great hotel) : 0,棒 游泳池 (Great swimming pool) : 0,日式 菜 (Japanese dishes) : 0,新 宿区 (Shinjuku) : 0,大 门脸 (Big door face) : 2,棒 商场 (Great mall) : 0
一般 宵夜 (Average supper) : 2,棒 隔音 (Soundproof) : 0,棒 灰 (Great ash) : 0,日式 街 (Japanese street) : 0,新 宿站 (Shinjuku Station) : 0,大 附近 (Large nearby) : 2,棒 地方 (Great place) : 0
一般 早晨 (Average morning) : 2,棒 风景 (Great scenery) : 0,棒 爷湖 (Great lake) : 0,日式 西式 (Japanese Western) : 0,新 宿西 (Shinjuku West) : 0,大 雨 (Heavy rain) : 2,棒 地段 (Great location) : 0
一般 景观 (General landscape) : 2,棒 风格 (Great style) : 0,棒 牛 (Great cow) : 0,日式 选择 (Japanese style) : 0,新 床 (New bed) : 0,大 馆 (Large hall) : 2,棒 地点 (Great location) : 0
一般 水准 (Average level) : 2,棒 食物 (Great food) : 0,棒 牛肉 (Great beef) : 0,日式 风味 (Japanese style) : 0,新 床单 (New sheets) : 0,好吃 三文鱼 (Delicious salmon) : 2,棒 大堂 (Great lobby) : 0
一般 海水 (General sea water) : 2,棒 餐厅 (Great restaurant) : 0,棒 环境 (Great environment) : 0,日式 风情 (Japanese style) : 0,新 店 (New shop) : 0,好吃 冰淇淋 (Delicious ice cream) : 2,棒 字 (Great letter;) : 0
一般 空间 (General space) : 2,棒 餐食 (Good meal) : 0,棒 班车 (Great shuttle) : 0,日式 风格 (Japanese style) : 0,新 心 (New heart) : 0,好吃 周围 (Delicious around) : 2,棒 家 (Great home) : 0
一般 缺点 (General disadvantages) : 2,棒 餐饮 (Great food) : 0,棒 球场 (Baseball field) : 0,日式 食物 (Japanese food) : 0,新 感觉 (New feeling) : 0,好吃 家 (Delicious) : 2,棒 巴士 (Great bus) : 0
一般 网速 (General Internet speed) : 2,棒 餐馆 (Great restaurant) : 0,棒 用品 (Great supplies) : 0,日式 餐厅 (Japanese restaurant) : 0,新 房 (New room) : 0,好吃 小店 (Delicious shop) : 2,棒 店 (Great shop) : 0
一般 购物 (General shopping) : 2,棒 馆 (Great hall) : 0,棒 真 (Awesome really) : 0,日式 餐馆 (Japanese restaurant) : 0,新 斋桥 (New Saibashi) : 0,好吃 巧克力 (Delicious chocolate) : 2,棒 总体 (Great overall) : 0
一般 选择 (General choice) : 2,棒 鸡 (Great chicken) : 0,棒 硬件 (Great hardware) : 0,日式 饭店 (Japanese restaurant) : 0,新 旧 (New old) : 0,好吃 房间 (Delicious room) : 2,棒 房 (Great room) : 0
一般 面积 (General area) : 2,欣赏 (enjoy) : 0,棒 管理 (Great management) : 0,棒 下面 (Great below) : 0,新 早餐 (New breakfast) : 0,好吃 料 (Delicious) : 2,棒 拉面 (Great ramen) : 0
一般 餐饮 (General Dining) : 2,没有 一流 (Not first class) : 0,棒 细节 (Great details) : 0,棒 业 (Great industry) : 0,新 服务 (New service) : 0,好吃 日餐 (Delicious Japanese food) : 2,棒 效果 (Great effect) : 0
一般 饭店 (Average restaurant) : 2,没有 中文 (no Chinese) : 0,棒 美景 (Great views) : 0,棒 中文 (Great in Chinese) : 0,新 本 (New) : 0,好吃 服务 (Delicious service) : 2,棒 整体 (Great overall) : 0
不错 .... (Not bad...) : 2,没有 交通 (No traffic) : 0,棒 美食 (Great gourmet) : 0,棒 主要 (Great main) : 0,新 机场 (New airport) : 0,好吃 材 (Delicious) : 2,棒 料理 (Great cuisine) : 0
不错 中文 (Good Chinese) : 2,没有 人员 (No personnel) : 0,棒 自助餐 (Great buffet) : 0,棒 交通 (Great traffic) : 0,新 板 (New board) : 0,好吃 泡芙 (Delicious puff) : 2,棒 方面 (Great aspect) : 0
不错 主楼 (Good main building) : 2,没有 价格 (No price) : 0,棒 花园 (Great garden) : 0,棒 享受 (Great enjoy) : 0,新 楼 (New building) : 0,好吃 牛超 (Delicious Niu Chao) : 2,棒 旅行 (Great travel) : 0
不错 之一 (Nice one) : 2,没有 便利 (No convenience) : 0,棒 英文 (Great English) : 0,棒 人 (Great man) : 0,新 毛巾 (New towel) : 0,好吃 米 (Delicious rice) : 2,棒 日航 (Great Nikko) : 0
不错 享受 (Nice enjoy) : 2,没有 出行 (No travel) : 0,棒 英语 (Great English) : 0,棒 人员 (Staff) : 0,新 潮 (New trend) : 0,好吃 茶点 (Delicious refreshment) : 2,棒 早饭 (Great breakfast) : 0
不错 人间 (Nice world) : 2,没有 卫生 (No hygiene) : 0,棒 茶 (Great tea) : 0,棒 价位 (Great price) : 0,新 王子 (New prince) : 0,好吃 草莓 (Delicious strawberry) : 2,棒 晚餐 (Great dinner) : 0
不错 住宅 (Good residential) : 2,没有 吃 (did not eat) : 0,棒 菜品 (Great dishes) : 0,棒 价格 (Great price) : 0,新 用品 (New supplies) : 0,好吃 菜 (Delicious dish) : 2,棒 景 (Great view) : 0
不错 做 (Good do) : 2,没有 周边 (No surroundings) : 0,棒 虾 (Great shrimp) : 0,棒 体验 (Great experience) : 0,新 硬件 (New hardware) : 0,好吃 蛋 (Delicious egg) : 2,棒 景观 (Great landscape) : 0
不错 内容 (Good content) : 2,没有 地方 (No place) : 0,棒 街 (Great street) : 0,棒 便利 (Great convenience) : 0,新 票 (New ticket) : 0,好吃 鸟 (Delicious bird) : 2,棒 服务员 (Great waiter) : 0
不错 出品 (Not bad) : 2,没有 地铁 (No subway) : 0,棒 装修 (Great decoration) : 0,棒 出行 (Great trip) : 0,新 程度 (New degree) : 0,干净 人间 (Clean world) : 2,棒 服务生 (Great waiter) : 0
不错 区 (Nice area) : 2,没有 地铁站 (No subway station) : 0,棒 视野 (Great) : 0,棒 前台 (Front desk) : 0,新 站 (New station) : 0,干净 厕浴 (Clean toilet bath) : 2,棒 条件 (Great condition) : 0
不错 厅 (Nice hall) : 2,没有 坐 (Not sitting) : 0,棒 设备 (Great equipment) : 0,棒 午餐 (Great lunch) : 0,新 视野 (New vision) : 0,干净 周围 (Clean around) : 2,棒 楼下 (Great downstairs) : 0
不错 去处 (Good place) : 2,没有 大 (No big) : 0,棒 设施 (Great facilities) : 0,棒 卫生 (Great hygiene) : 0,新 谷 (New Valley) : 0,干净 周边 (Clean surroundings) : 2,棒 水平 (Great level) : 0
不错 反应 (Good response) : 2,没有 好吃 (No delicious) : 0,棒 设计 (Great design) : 0,棒 卫生间 (Great toilet) : 0,新 轮 (New round) : 0,干净 国家 (Clean country) : 2,棒 水果 (Great fruit) : 0
不错 台 (Not bad) : 2,没有 干净 (No clean) : 0,棒 超市 (Great supermarket) : 0,棒 口味 (Great taste) : 0,新 阪急 (New Hankyu) : 0,干净 地板 (Clean floor) : 2,棒 沙滩 (Great beach) : 0
不错 哒 (Not bad) : 2,没有 推荐 (Not recommended) : 0,棒 软件 (Great software) : 0,棒 周边 (Great surroundings) : 0,新 馆 (New building) : 0,干净 墙面 (Clean wall) : 2,棒 泳池 (Great pool) : 0
不错 商业 (Good business) : 2,没有 新 (No new) : 0,棒 酒店 (Great hotel) : 0,棒 味道 (Great taste) : 0,新 高楼 (New high-rise) : 0,干净 床铺 (Clean bed) : 2,棒 洗衣机 (Great washing machine) : 0
不错 商业街 (Good commercial street) : 2,没有 早餐 (No breakfast) : 0,棒 隔音 (Soundproof) : 0,棒 咖啡 (Great coffee) : 0,日式 东西 (Japanese style) : 0,干净 性价比 (Clean and cost-effective) : 2,棒 浴场 (Great bath) : 0
不错 地理 (Good geography) : 2,没有 时候 (No time) : 0,棒 风景 (Great scenery) : 0,棒 商场 (Great mall) : 0,日式 之一 (Japanese style one) : 0,干净 房屋 (Clean house) : 2,棒 浴室 (Great bathroom) : 0
不错 地角 (Not bad) : 2,没有 是否 (No if) : 0,棒 风格 (Great style) : 0,棒 地方 (Great place) : 0,日式 人 (People) : 0,干净 整理 (Clean up) : 2,棒 海景 (Great sea view) : 0
不错 外景 (Good location) : 2,没有 景色 (No view) : 0,棒 食物 (Great food) : 0,棒 地段 (Great location) : 0,日式 吃 (Eating) : 0,干净 方 (Clean party) : 2,棒 海滩 (Great beach) : 0
不错 套餐 (Good set meal) : 2,没有 棒 (No stick) : 0,棒 餐厅 (Great restaurant) : 0,棒 地点 (Great location) : 0,日式 味道 (Japanese taste) : 0,干净 方面 (Clean aspect) : 2,棒 温泉 (Great hot spring) : 0
不错 实惠 (Good affordable) : 2,没有 欣赏 (No appreciation) : 0,棒 餐食 (Good meal) : 0,棒 夜景 (Night view) : 0,日式 品种 (Japanese style) : 0,干净 有 (Clean yes) : 2,棒 游泳池 (Great swimming pool) : 0
不错 寿司 (Good sushi) : 2,没有 漂亮 (Not beautiful) : 0,棒 餐饮 (Great food) : 0,棒 大堂 (Great lobby) : 0,日式 套餐 (Japanese set meal) : 0,干净 服务员 (Clean waiter) : 2,棒 灰 (Great ash) : 0
不错 庭院 (Nice courtyard) : 2,没有 环境 (No environment) : 0,棒 餐馆 (Great restaurant) : 0,棒 字 (Great letter;) : 0,日式 店 (Japanese shop) : 0,干净 条件 (Clean condition) : 2,棒 爷湖 (Great lake) : 0
不错 按摩椅 (Nice massage chair) : 2,没有 真心 (Not true) : 0,棒 馆 (Great hall) : 0,棒 家 (Great home) : 0,日式 庭院 (Japanese style courtyard) : 0,干净 档 (Clean file) : 2,棒 牛 (Great cow) : 0
不错 放假 (Good holiday) : 2,没有 算 (No count) : 0,棒 鸡 (Great chicken) : 0,棒 巴士 (Great bus) : 0,日式 怀石料理 (Japanese kaiseki cuisine) : 0,干净 毛巾 (Clean towel) : 2,棒 班车 (Great shuttle) : 0
不错 料 (Not bad) : 2,没有 美食 (No gourmet) : 0,欣赏 (enjoy) : 0,棒 店 (Great shop) : 0,日式 态度 (Japanese attitude) : 0,干净 水准 (Clean standard) : 2,棒 用品 (Great supplies) : 0
不错 旅游 (Nice tourist) : 2,没有 舒服 (Not comfortable) : 0,没有 一流 (Not first class) : 0,棒 态度 (Great attitude) : 0,日式 感觉 (Japanese style) : 0,干净 洗 (Clean wash) : 2,棒 硬件 (Great hardware) : 0
不错 旅馆 (Nice hotel) : 2,没有 购物 (No shopping) : 0,没有 交通 (No traffic) : 0,棒 总体 (Great overall) : 0,日式 房 (Japanese style room) : 0,干净 洗浴 (Clean bath) : 2,棒 管理 (Great management) : 0
不错 日航 (Good Nikko) : 2,没有 赞 (No like) : 0,没有 人员 (No personnel) : 0,棒 感觉 (Great feeling) : 0,日式 房间 (Japanese style room) : 0,干净 浴 (Clean bath) : 2,棒 细节 (Great details) : 0
不错 早歺 (Good morning) : 2,没有 距离 (No distance) : 0,没有 价格 (No price) : 0,棒 房 (Great room) : 0,日式 按摩 (Japanese massage) : 0,干净 海滩 (Clean beach) : 2,棒 美景 (Great views) : 0
不错 晚饭 (Good dinner) : 2,没有 过 (Never had) : 0,没有 便利 (No convenience) : 0,棒 拉面 (Great ramen) : 0,日式 旅馆 (Ryokan) : 0,干净 照片 (Clean photos) : 2,棒 美食 (Great gourmet) : 0
不错 景点 (Good attractions) : 2,没有 近 (No near) : 0,没有 出行 (No travel) : 0,棒 效果 (Great effect) : 0,日式 早饭 (Japanese breakfast) : 0,干净 物品 (Clean items) : 2,棒 自助餐 (Great buffet) : 0
不错 村 (Nice village) : 2,没有 选择 (no choice) : 0,没有 卫生 (No hygiene) : 0,棒 整体 (Great overall) : 0,日式 标准 (Japanese standard) : 0,干净 特色 (Clean features) : 2,棒 花园 (Great garden) : 0
不错 档次 (Not bad grade) : 2,没有 问题 (no problem) : 0,没有 吃 (did not eat) : 0,棒 料理 (Great cuisine) : 0,日式 榻榻米 (Japanese style tatami) : 0,干净 白布 (Clean white cloth) : 2,棒 英文 (Great English) : 0
不错 楼 (Good floor) : 2,没有 附近 (Not nearby) : 0,没有 周边 (No surroundings) : 0,棒 方面 (Great aspect) : 0,日式 欧式 (Japanese style) : 0,干净 细节 (Clean details) : 2,棒 茶 (Great tea) : 0
不错 楼层 (Good floor) : 2,没有 陈旧 (Not stale) : 0,没有 地方 (No place) : 0,棒 旅行 (Great travel) : 0,日式 浴 (Japanese bath) : 0,干净 装修 (Clean decoration) : 2,棒 菜品 (Great dishes) : 0
不错 氛围 (Nice atmosphere) : 2,没有 风景 (No scenery) : 0,没有 地铁 (No subway) : 0,棒 日航 (Great Nikko) : 0,日式 浴场 (Japanese style bath) : 0,干净 风格 (Clean style) : 2,棒 虾 (Great shrimp) : 0
不错 水果 (Good fruit) : 2,漂亮 (Pretty) : 0,没有 地铁站 (No subway station) : 0,棒 早饭 (Great breakfast) : 0,日式 浴室 (Japanese style bathroom) : 0,干净 饭店 (Clean restaurant) : 2,棒 街 (Great street) : 0
不错 泡汤 (Good bathing) : 2,漂亮 人 (Beautiful people) : 0,没有 坐 (Not sitting) : 0,棒 晚餐 (Great dinner) : 0,日式 浴衣 (Japanese Yukata) : 0,干净 麻雀 (Clean sparrow) : 2,棒 装修 (Great decoration) : 0
不错 洁度 (Good cleanliness) : 2,漂亮 前台 (Beautiful) : 0,没有 大 (No big) : 0,棒 景 (Great view) : 0,日式 温泉 (Japanese hot spring) : 0,快捷 便利 (Fast and convenient) : 2,棒 视野 (Great) : 0
不错 洗衣机 (Good washing machine) : 2,漂亮 地方 (Beautiful place) : 0,没有 好吃 (No delicious) : 0,棒 景色 (Great scenery) : 0,日式 澡堂 (Japanese style bathhouse) : 0,新 主楼 (New main building) : 2,棒 设备 (Great equipment) : 0
不错 海洋馆 (Good aquarium) : 2,漂亮 塔 (Beautiful tower) : 0,没有 推荐 (Not recommended) : 0,棒 景观 (Great landscape) : 0,日式 火锅 (Japanese hot pot) : 0,新 价 (New price) : 2,棒 设计 (Great design) : 0
不错 澡堂 (Nice bathhouse) : 2,漂亮 外观 (Beautiful appearance) : 0,没有 新 (No new) : 0,棒 服务员 (Great waiter) : 0,日式 种类 (Japanese style) : 0,新 利 (Xinli) : 2,棒 超市 (Great supermarket) : 0
不错 烤肉店 (Good rotisserie) : 2,漂亮 夜景 (Beautiful) : 0,没有 早餐 (No breakfast) : 0,棒 服务生 (Great waiter) : 0,日式 窗户 (Japanese style window) : 0,新 去 (New go) : 2,棒 软件 (Great software) : 0
不错 烧肉 (Good roast pork) : 2,漂亮 大厅 (Pretty hall) : 0,没有 时候 (No time) : 0,棒 条件 (Great condition) : 0,日式 结合 (Japanese style) : 0,新 商场 (New mall) : 2,棒 隔音 (Soundproof) : 0
不错 热汤 (Good hot soup) : 2,漂亮 大堂 (Beautiful lobby) : 0,没有 是否 (No if) : 0,棒 棒 (Great Great) : 0,日式 自助餐 (Japanese buffet) : 0,新 地方 (New place) : 2,棒 风景 (Great scenery) : 0
不错 热海 (Not bad Atami) : 2,漂亮 妹子 (Pretty girl) : 0,没有 景色 (No view) : 0,棒 楼下 (Great downstairs) : 0,日式 花园 (Japanese garden) : 0,新 坂 (Shin Saka) : 2,棒 风格 (Great style) : 0
不错 牌子 (Good brand) : 2,漂亮 姑娘 (beautiful girl) : 0,没有 棒 (No stick) : 0,棒 水果 (Great fruit) : 0,日式 英文 (Japanese English) : 0,新 大楼 (New building) : 2,棒 食物 (Great food) : 0
不错 甜点 (Nice dessert) : 2,漂亮 对面 (Pretty opposite) : 0,没有 欣赏 (No appreciation) : 0,棒 沙滩 (Great beach) : 0,日式 英语 (Japanese English) : 0,新 宿ビ (Shinjuku ビ) : 2,棒 餐食 (Good meal) : 0
不错 用具 (Good utensils) : 2,漂亮 广场 (Pretty square) : 0,没有 漂亮 (Not beautiful) : 0,棒 泳池 (Great pool) : 0,日式 菜 (Japanese dishes) : 0,新 床单 (New sheets) : 2,棒 餐饮 (Great food) : 0
不错 种类 (Good type) : 2,漂亮 庭院 (Pretty courtyard) : 0,没有 环境 (No environment) : 0,棒 洗衣机 (Great washing machine) : 0,日式 街 (Japanese street) : 0,新 心 (New heart) : 2,棒 餐馆 (Great restaurant) : 0
不错 窗户 (Nice windows) : 2,漂亮 建筑 (Beautiful building) : 0,没有 真心 (Not true) : 0,棒 浴场 (Great bath) : 0,日式 选择 (Japanese style) : 0,新 斋桥 (New Saibashi) : 2,棒 馆 (Great hall) : 0
不错 美食 (Good food) : 2,漂亮 房 (Beautiful room) : 0,没有 算 (No count) : 0,棒 浴室 (Great bathroom) : 0,日式 风味 (Japanese style) : 0,新 早餐 (New breakfast) : 2,棒 鸡 (Great chicken) : 0
不错 肉食 (Good meat) : 2,漂亮 房间 (Nice room) : 0,没有 美食 (No gourmet) : 0,棒 海景 (Great sea view) : 0,日式 风情 (Japanese style) : 0,新 板 (New board) : 2,没有 一流 (Not first class) : 0
不错 花园 (Nice garden) : 2,漂亮 景 (Beautiful scene) : 0,没有 舒服 (Not comfortable) : 0,棒 海滩 (Great beach) : 0,日式 食物 (Japanese food) : 0,新 票 (New ticket) : 2,没有 交通 (No traffic) : 0
不错 街景 (Good street view) : 2,漂亮 景色 (Beautiful view) : 0,没有 购物 (No shopping) : 0,棒 游泳池 (Great swimming pool) : 0,日式 饭店 (Japanese restaurant) : 0,新 视野 (New vision) : 2,没有 人员 (No personnel) : 0
不错 质 (Good quality) : 2,漂亮 景观 (Beautiful landscape) : 0,没有 赞 (No like) : 0,棒 灰 (Great ash) : 0,棒 下面 (Great below) : 0,新 高楼 (New high-rise) : 2,没有 价格 (No price) : 0
不错 走路 (Good walk) : 2,漂亮 服务员 (Pretty waiter) : 0,没有 距离 (No distance) : 0,棒 爷湖 (Great lake) : 0,棒 业 (Great industry) : 0,日式 怀石料理 (Japanese kaiseki cuisine) : 2,没有 便利 (No convenience) : 0
不错 路线 (Good route) : 2,漂亮 楼下 (Pretty downstairs) : 0,没有 过 (Never had) : 0,棒 牛 (Great cow) : 0,棒 中文 (Great in Chinese) : 0,日式 感觉 (Japanese style) : 2,没有 出行 (No travel) : 0
不错 酒廊 (Nice lounge) : 2,漂亮 樱花 (Beautiful cherry blossom) : 0,没有 近 (No near) : 0,棒 牛肉 (Great beef) : 0,棒 主要 (Great main) : 0,日式 按摩 (Japanese massage) : 2,没有 卫生 (No hygiene) : 0
不错 采光 (Good lighting) : 2,漂亮 气派 (Beautiful style) : 0,没有 选择 (no choice) : 0,棒 环境 (Great environment) : 0,棒 交通 (Great traffic) : 0,日式 欧式 (Japanese style) : 2,没有 周边 (No surroundings) : 0
不错 里面 (Good inside) : 2,漂亮 沙滩 (Beautiful beach) : 0,没有 问题 (no problem) : 0,棒 班车 (Great shuttle) : 0,棒 享受 (Great enjoy) : 0,日式 浴 (Japanese bath) : 2,没有 地铁 (No subway) : 0
不错 量 (Good amount) : 2,漂亮 海景 (Beautiful seascape) : 0,没有 附近 (Not nearby) : 0,棒 球场 (Baseball field) : 0,棒 人 (Great man) : 0,日式 浴衣 (Japanese Yukata) : 2,没有 地铁站 (No subway station) : 0
不错 门口 (Good doorway) : 2,漂亮 海滩 (Pretty beach) : 0,没有 陈旧 (Not stale) : 0,棒 用品 (Great supplies) : 0,棒 人员 (Staff) : 0,日式 种类 (Japanese style) : 2,没有 坐 (Not sitting) : 0
不错 隔离 (Good isolation) : 2,漂亮 温泉 (Beautiful hot spring) : 0,没有 风景 (No scenery) : 0,棒 真 (Awesome really) : 0,棒 价位 (Great price) : 0,日式 英语 (Japanese English) : 2,没有 大 (No big) : 0
不错 面 (Good noodles) : 2,漂亮 游泳池 (Nice swimming pool) : 0,漂亮 人 (Beautiful people) : 0,棒 硬件 (Great hardware) : 0,棒 价格 (Great price) : 0,日式 街 (Japanese street) : 2,没有 好吃 (No delicious) : 0
不错 音响 (Good stereo) : 2,漂亮 环境 (Beautiful environment) : 0,漂亮 前台 (Beautiful) : 0,棒 管理 (Great management) : 0,棒 便利 (Great convenience) : 0,日式 风味 (Japanese style) : 2,没有 干净 (No clean) : 0
不错 预定 (Good book) : 2,漂亮 花园 (Pretty garden) : 0,漂亮 地方 (Beautiful place) : 0,棒 细节 (Great details) : 0,棒 出行 (Great trip) : 0,日式 风情 (Japanese style) : 2,没有 推荐 (Not recommended) : 0
不错 食 (Good food) : 2,漂亮 菜 (Beautiful dish) : 0,漂亮 塔 (Beautiful tower) : 0,棒 美景 (Great views) : 0,棒 前台 (Front desk) : 0,日式 饭店 (Japanese restaurant) : 2,没有 新 (No new) : 0
不错 饭团 (Good rice ball) : 2,漂亮 装修 (Beautiful decoration) : 0,漂亮 外观 (Beautiful appearance) : 0,棒 美食 (Great gourmet) : 0,棒 午餐 (Great lunch) : 0,棒 下面 (Great below) : 2,没有 时候 (No time) : 0
不错 饮料 (Good drink) : 2,漂亮 装饰 (Beautiful decoration) : 0,漂亮 夜景 (Beautiful) : 0,棒 自助餐 (Great buffet) : 0,棒 卫生 (Great hygiene) : 0,棒 业 (Great industry) : 2,没有 是否 (No if) : 0
不错 鸡肉 (Good chicken) : 2,漂亮 视野 (Beautiful vision) : 0,漂亮 大厅 (Pretty hall) : 0,棒 花园 (Great garden) : 0,棒 卫生间 (Great toilet) : 0,棒 中文 (Great in Chinese) : 2,没有 景色 (No view) : 0
不错 鸡蛋 (Nice eggs) : 2,漂亮 设计 (Beautiful design) : 0,漂亮 大堂 (Beautiful lobby) : 0,棒 英文 (Great English) : 0,棒 口味 (Great taste) : 0,棒 主要 (Great main) : 2,没有 棒 (No stick) : 0
五星级 品质 (Five-star quality) : 2,漂亮 酒店 (Beautiful hotel) : 0,漂亮 妹子 (Pretty girl) : 0,棒 英语 (Great English) : 0,棒 周边 (Great surroundings) : 0,棒 交通 (Great traffic) : 2,没有 欣赏 (No appreciation) : 0
五星级 大堂 (Five-star lobby) : 2,漂亮 风景 (Beautiful scenery) : 0,漂亮 姑娘 (beautiful girl) : 0,棒 茶 (Great tea) : 0,棒 咖啡 (Great coffee) : 0,棒 享受 (Great enjoy) : 2,没有 漂亮 (Not beautiful) : 0
五星级 房间 (Five-star room) : 2,漂亮 餐厅 (Beautiful restaurant) : 0,漂亮 对面 (Pretty opposite) : 0,棒 菜品 (Great dishes) : 0,棒 商场 (Great mall) : 0,棒 人员 (Staff) : 2,没有 环境 (No environment) : 0
便利 份 (Convenience) : 2,烤肉 (Barbecue) : 0,漂亮 广场 (Pretty square) : 0,棒 虾 (Great shrimp) : 0,棒 地方 (Great place) : 0,棒 价位 (Great price) : 2,没有 真心 (Not true) : 0
便利 卫生 (Convenience and hygiene) : 2,热情 (enthusiasm) : 0,漂亮 庭院 (Pretty courtyard) : 0,棒 街 (Great street) : 0,棒 地点 (Great location) : 0,棒 便利 (Great convenience) : 2,没有 算 (No count) : 0
