大 双人房 (Large double room) : 4,好吃 晚餐 (Delicious dinner) : 0,大 问题 (Big problem) : 0,大 汤 (Big soup) : 0,大 卫生 (Great hygiene) : 0,不错 舒适度 (Good comfort) : 3,大 空调 (Large air conditioning) : 0
大 反差 (Great contrast) : 4,好吃 服务 (Delicious service) : 0,大 阳台 (Large balcony) : 0,大 沙发 (Big sofa) : 0,大 印象 (Big impression) : 0,不错 设计 (Nice design) : 3,大 窗 (Big window) : 0
大 味 (Big taste) : 4,好吃 材 (Delicious) : 0,大 附近 (Large nearby) : 0,大 沙滩 (Big beach) : 0,大 厨房 (Big kitchen) : 0,不错 话 (Good words) : 3,大 窗户 (Big windows) : 0
大 坡 (Big slope) : 4,好吃 楼下 (Delicious downstairs) : 0,大 雨 (Heavy rain) : 0,大 河 (Big river) : 0,大 去 (Big go) : 0,不错 轮 (Nice round) : 3,大 站 (Big station) : 0
大 夜景 (Big night view) : 4,好吃 水果 (Delicious fruit) : 0,大 雪 (Heavy snow) : 0,大 波动 (Large fluctuations) : 0,大 双人房 (Large double room) : 0,不错 配套 (Good package) : 3,大 站点 (Big site) : 0
大 大小 (Big size) : 4,好吃 泡芙 (Delicious puff) : 0,大 面积 (large area) : 0,大 泳池 (Big swimming pool) : 0,大 反差 (Great contrast) : 0,不错 配置 (Good configuration) : 3,大 箱 (big box) : 0
大 套间 (Large suite) : 4,好吃 海鲜 (Delicious seafood) : 0,大 风 (Strong wind) : 0,大 洋 (Ocean) : 0,大 变化 (Big change) : 0,不错 附近 (Not bad nearby) : 3,大 纸 (Large paper) : 0
大 实惠 (Great affordable) : 4,好吃 火腿 (Delicious ham) : 0,大 风雪 (Heavy snow) : 0,大 洗 (Big wash) : 0,大 号 (Large number) : 0,不错 饭 (Good meal) : 3,大 线 (Big line) : 0
大 希望 (Big hope) : 4,好吃 点心 (Delicious dim sum) : 0,大 食 (Big food) : 0,大 洗手间 (Big toilet) : 0,大 吃 (Big eat) : 0,不错 饭馆 (Good restaurant) : 3,大 缺点 (Big disadvantage) : 0
大 忙 (Very busy) : 4,好吃 烧烤 (Delicious barbecue) : 0,大 食堂 (Big canteen) : 0,大 流量 (Large Flow) : 0,大 名气 (Big fame) : 0,五星级 水平 (Five-star level) : 3,大 美食 (Great gourmet) : 0
大 态度 (Big attitude) : 4,好吃 牛 (Delicious cow) : 0,大 餐厅 (Big restaurant) : 0,大 浴 (Big bath) : 0,大 吸烟室 (Big smoking room) : 0,便利 中心 (Convenience Center) : 3,大 胃口 (Big appetite) : 0
大 总体 (Big overall) : 4,好吃 牛肉 (Delicious beef) : 0,大 饭店 (restaurant) : 0,大 浴场 (Large bath) : 0,大 周边 (Surrounding) : 0,便利 公交车 (Convenience) : 3,大 花园 (Big garden) : 0
大 斜坡 (Big slope) : 4,好吃 牛超 (Delicious Niu Chao) : 0,大 馆 (Large hall) : 0,大 浴室 (Big bathroom) : 0,大 味儿 (Big taste) : 0,便利 商场 (Convenience shopping mall) : 3,大 范围 (A wide range of) : 0
大 晚上 (Big night) : 4,好吃 甜点 (Delicious dessert) : 0,大 马 (Malaysia) : 0,大 浴池 (Big bath) : 0,大 品牌 (famous brand) : 0,便利 地点 (Convenient location) : 3,大 药 (Big medicine) : 0
大 楼 (Big building) : 4,好吃 盖饭 (Delicious rice bowl) : 0,大 马路 (Big road) : 0,大 浴缸 (Big bathtub) : 0,大 品种 (Large variety) : 0,便利 屋 (Convenience) : 3,大 药妆 (Big cosmeceutical) : 0
大 泳池 (Big swimming pool) : 4,好吃 米 (Delicious rice) : 0,大 鸟 (Big bird) : 0,大 海 (Big sea) : 0,大 商 (Big business) : 0,便利 步行 (Convenient on foot) : 3,大 药妆店 (Big drugstore) : 0
大 热 (Big hot) : 4,好吃 米饭 (Delicious rice) : 0,好吃 三文鱼 (Delicious salmon) : 0,大 海景 (Large sea view) : 0,大 商业区 (Large business district) : 0,便利 超市 (Convenience supermarket) : 3,大 药店 (Big pharmacy) : 0
大 药 (Big medicine) : 4,好吃 肉饭 (Delicious pilaf) : 0,好吃 东西 (Delicious stuff) : 0,大 海边 (Big seaside) : 0,大 商业街 (Big commercial street) : 0,便利 重要 (Convenient important) : 3,大 落地窗 (Large French windows) : 0
大 药妆店 (Big drugstore) : 4,好吃 自助餐 (Delicious buffet) : 0,好吃 中餐厅 (Delicious chinese restaurant) : 0,大 清早 (Early morning) : 0,大 商圈 (Big business district) : 0,大 上 (Big up) : 3,大 落差 (Big drop) : 0
大 蟑螂 (Big cockroach) : 4,好吃 茶点 (Delicious refreshment) : 0,好吃 丼 (Delicious don) : 0,大 温泉 (Big hot spring) : 0,大 噪声 (Big noise) : 0,大 中转站 (Big transfer station) : 3,大 螃蟹 (Big crab) : 0
大 通 (Chase) : 4,好吃 草莓 (Delicious strawberry) : 0,好吃 做 (Delicious do) : 0,大 游乐场 (Big playground) : 0,大 困难 (Big difficulty) : 0,大 停车场 (Large parking lot) : 3,大 蟑螂 (Big cockroach) : 0
大 雨 (Heavy rain) : 4,好吃 菜 (Delicious dish) : 0,好吃 冰棍 (Delicious popsicles) : 0,大 满足 (Big satisfaction) : 0,大 圈子 (Big circle) : 0,大 单人间 (Large single room) : 3,大 行 (Daxing) : 0
好吃 居酒屋 (Delicious izakaya) : 4,好吃 菜品 (Delicious dishes) : 0,好吃 冰淇淋 (Delicious ice cream) : 0,大 澡堂 (Big bathhouse) : 0,大 地段 (Large area) : 0,大 卧室 (Large bedroom) : 3,大 行李 (Big luggage) : 0
好吃 方便面 (Delicious instant noodles) : 4,好吃 虾 (Delicious shrimp) : 0,好吃 冰激凌 (Delicious ice cream) : 0,大 灰 (Big gray) : 0,大 地铁站 (Metro station) : 0,大 去 (Big go) : 3,大 行李箱 (Large suitcase) : 0
好吃 水果 (Delicious fruit) : 4,好吃 蛋 (Delicious egg) : 0,好吃 卫生 (Delicious and hygienic) : 0,大 灰尘 (Big dust) : 0,大 场地 (Large venue) : 0,大 双人床 (Large double bed) : 3,大 街 (Big street) : 0
好吃 海鲜 (Delicious seafood) : 4,好吃 蛋糕 (Delicious cake) : 0,好吃 吃 (Delicious eat) : 0,大 热 (Big hot) : 0,大 坡 (Big slope) : 0,大 双人房 (Large double room) : 3,大 被子 (Big quilt) : 0
好吃 牛肉 (Delicious beef) : 4,好吃 蜜 (Delicious honey) : 0,好吃 周围 (Delicious around) : 0,大 热天 (Big hot day) : 0,大 塚 (Otsuka) : 0,大 双人间 (Large double room) : 3,大 装修 (Large decoration) : 0
好吃 酒店 (Delicious hotel) : 4,好吃 西餐 (Delicious western food) : 0,好吃 周边 (Delicious) : 0,大 热水 (Big hot water) : 0,大 外观 (Large appearance) : 0,大 城 (Big city) : 3,大 规模 (Large scale) : 0
好吃 附近 (Delicious nearby) : 4,好吃 豆 (Delicious beans) : 0,好吃 味道 (Delicious taste) : 0,大 爆发 (Big burst) : 0,大 夜景 (Big night view) : 0,大 套房 (Large suite) : 3,大 设备 (Big equipment) : 0
好吃 面 (Delicious noodles) : 4,好吃 豆腐 (Delicious tofu) : 0,好吃 地方 (Delicious place) : 0,大 爱 (Big Love) : 0,大 大厅 (Big hall) : 0,大 套间 (Large suite) : 3,大 话 (Big words) : 0
好吃 餐点 (Delicious meal) : 4,好吃 酒店 (Delicious hotel) : 0,好吃 妻 (Delicious wife) : 0,大 片 (Blockbuster) : 0,大 大小 (Big size) : 0,大 好评 (Great praise) : 3,大 谷 (Otani) : 0
好吃 馆 (Delicious restaurant) : 4,好吃 附近 (Delicious nearby) : 0,好吃 家 (Delicious) : 0,大 版 (Large version) : 0,大 天桥 (Big bridge) : 0,大 宾馆 (Big hotel) : 3,大 败笔 (Big failure) : 0
干净 前台 (Clean front desk) : 4,好吃 雪糕 (Delicious ice cream) : 0,好吃 寿司 (Delicious sushi) : 0,大 牌子 (Big brand) : 0,大 套房 (Large suite) : 0,大 小孩 (Big child) : 3,大 超市 (big supermarket) : 0
干净 印象 (Clean impression) : 4,好吃 面 (Delicious noodles) : 0,好吃 寿司店 (Delicious sushi restaurant) : 0,大 特点 (Big features) : 0,大 套间 (Large suite) : 0,大 小时 (Big hours) : 3,大 路 (Road) : 0
干净 周围 (Clean around) : 4,好吃 面包 (Delicious bread) : 0,好吃 小店 (Delicious shop) : 0,大 特色 (Features) : 0,大 好处 (Big benefit) : 0,大 尺寸 (large size) : 3,大 路口 (Big intersection) : 0
干净 墙壁 (Clean the walls) : 4,好吃 面包房 (Delicious bakery) : 0,好吃 居酒屋 (Delicious izakaya) : 0,大 环境 (Large environment) : 0,大 好评 (Great praise) : 0,大 山 (Mountain) : 3,大 车站 (Big station) : 0
干净 屋子 (Clean house) : 4,好吃 面馆 (Delicious noodle shop) : 0,好吃 巧克力 (Delicious chocolate) : 0,大 玻璃 (Large glass) : 0,大 姐姐 (big sister) : 0,大 巴士 (Big bus) : 3,大 选择性 (Large selectivity) : 0
干净 毛巾 (Clean towel) : 4,好吃 食物 (Delicious food) : 0,好吃 布丁 (Delicious pudding) : 0,大 玻璃窗 (Large glass windows) : 0,大 学区 (Big school district) : 0,大 影响 (Big impact) : 3,大 通 (Chase) : 0
干净 气 (Clean gas) : 4,好吃 餐 (Delicious meal) : 0,好吃 店 (Delicious shop) : 0,大 瓶 (Big bottle) : 0,大 孩子 (Big boy) : 0,大 忙 (Very busy) : 3,大 通路 (Large access) : 0
干净 浴场 (Clean bath) : 4,好吃 餐厅 (Delicious restaurant) : 0,好吃 房间 (Delicious room) : 0,大 用品 (Big supplies) : 0,大 宝宝 (Big baby) : 0,大 总体 (Big overall) : 3,大 通道 (Large channel) : 0
干净 简介 (Clean introduction) : 4,好吃 餐点 (Delicious meal) : 0,好吃 拉面 (Delicious ramen) : 0,大 用途 (Big purpose) : 0,大 实惠 (Great affordable) : 0,大 想象 (Big imagination) : 3,大 遗憾 (Big regret) : 0
干净 细节 (Clean details) : 4,好吃 餐馆 (Delicious restaurant) : 0,好吃 排队 (Delicious) : 0,大 电梯 (Big elevator) : 0,大 客流 (Large passenger flow) : 0,大 折扣 (Big discounts) : 3,大 部分 (Most part) : 0
干净 街道 (Clean street) : 4,好吃 饭 (Delicious meal) : 0,好吃 料 (Delicious) : 0,大 电脑 (Big computer) : 0,大 家庭 (extended family) : 0,大 整体 (Big overall) : 3,大 部队 (Large forces) : 0
干净 门 (Clean door) : 4,好吃 饭团 (Delicious rice ball) : 0,好吃 料理 (Delicious food) : 0,大 电视 (Big tv) : 0,大 小孩 (Big child) : 0,大 斜坡 (Big slope) : 3,大 都会 (Metropolis) : 0
新 地铁 (New subway) : 4,好吃 饭店 (Delicious restaurant) : 0,好吃 方便面 (Delicious instant noodles) : 0,大 百货 (Big department store) : 0,大 小时 (Big hours) : 0,大 晚上 (Big night) : 3,大 都市 (Metropolis) : 0
新 店 (New shop) : 4,好吃 饭菜 (Delicious meal) : 0,好吃 日餐 (Delicious Japanese food) : 0,大 百货店 (Big department store) : 0,大 小樽 (Big Otaru) : 0,大 景观 (Large landscape) : 3,大 采购 (Big purchase) : 0
新 硬件 (New hardware) : 4,好吃 馆 (Delicious restaurant) : 0,好吃 早饭 (Delicious breakfast) : 0,大 盒子 (Big box) : 0,大 尺寸 (large size) : 0,大 楼下 (Big downstairs) : 3,大 里面 (Big inside) : 0
日式 之一 (Japanese style one) : 4,好吃 鸟 (Delicious bird) : 0,好吃 晚餐 (Delicious dinner) : 0,大 目测 (Large visual inspection) : 0,大 屋 (Big house) : 0,大 欺客 (Big bully) : 3,大 量 (Large amount) : 0
日式 品种 (Japanese style) : 4,好吃 😋 (Delicious 😋) : 0,好吃 服务 (Delicious service) : 0,大 真 (Big really) : 0,大 屏幕 (big screen) : 0,大 毛巾 (Big towel) : 3,大 金 (Big gold) : 0
日式 店 (Japanese shop) : 4,客房 (Room) : 0,好吃 材 (Delicious) : 0,大 福音 (Great gospel) : 0,大 山 (Mountain) : 0,大 水流 (Big water flow) : 3,大 门 (Big gate) : 0
日式 浴场 (Japanese style bath) : 4,干净 (clean) : 0,好吃 楼下 (Delicious downstairs) : 0,大 秋叶原 (Great Akihabara) : 0,大 差别 (Big difference) : 0,大 江 (Big river) : 3,大 门口 (main entrance) : 0
日式 温泉 (Japanese hot spring) : 4,干净 一如既往 (Clean as always) : 0,好吃 水果 (Delicious fruit) : 0,大 空调 (Large air conditioning) : 0,大 差异 (Big difference) : 0,大 池 (Big pool) : 3,大 门脸 (Big door face) : 0
日式 澡堂 (Japanese style bathhouse) : 4,干净 五脏俱全 (Clean and complete) : 0,好吃 泡芙 (Delicious puff) : 0,大 窗 (Big window) : 0,大 差距 (Big gap) : 0,大 汤 (Big soup) : 3,大 门面 (Large facade) : 0
日式 饭店 (Japanese restaurant) : 4,干净 人间 (Clean world) : 0,好吃 海鲜 (Delicious seafood) : 0,大 窗户 (Big windows) : 0,大 巴士 (Big bus) : 0,大 河 (Big river) : 3,大 问题 (Big problem) : 0
棒 出行 (Great trip) : 4,干净 价格 (Clean price) : 0,好吃 火腿 (Delicious ham) : 0,大 站 (Big station) : 0,大 市区 (Large urban area) : 0,大 流量 (Large Flow) : 3,大 阳台 (Large balcony) : 0
棒 商场 (Great mall) : 4,干净 位置 (Clean location) : 0,好吃 点心 (Delicious dim sum) : 0,大 站点 (Big site) : 0,大 市场 (Big market) : 0,大 海 (Big sea) : 3,大 附近 (Large nearby) : 0
棒 拉面 (Great ramen) : 4,干净 内部 (Clean interior) : 0,好吃 烧烤 (Delicious barbecue) : 0,大 箱 (big box) : 0,大 希望 (Big hope) : 0,大 玻璃 (Large glass) : 3,大 雨 (Heavy rain) : 0
棒 景 (Great view) : 4,干净 前台 (Clean front desk) : 0,好吃 牛 (Delicious cow) : 0,大 纸 (Large paper) : 0,大 带 (Large belt) : 0,大 用途 (Big purpose) : 3,大 雪 (Heavy snow) : 0
棒 班车 (Great shuttle) : 4,干净 卫生 (Clean and hygienic) : 0,好吃 牛肉 (Delicious beef) : 0,大 线 (Big line) : 0,大 帮助 (Great help) : 0,大 线 (Big line) : 3,大 风 (Strong wind) : 0
棒 用品 (Great supplies) : 4,干净 卫生间 (Clean toilet) : 0,好吃 牛超 (Delicious Niu Chao) : 0,大 缺点 (Big disadvantage) : 0,大 平台 (Large platform) : 0,大 范围 (A wide range of) : 3,大 风雪 (Heavy snow) : 0
棒 视野 (Great) : 4,干净 印象 (Clean impression) : 0,好吃 甜点 (Delicious dessert) : 0,大 美食 (Great gourmet) : 0,大 广场 (Big square) : 0,大 行 (Daxing) : 3,大 食 (Big food) : 0
棒 超市 (Great supermarket) : 4,干净 厕所 (Clean toilet) : 0,好吃 盖饭 (Delicious rice bowl) : 0,大 胃口 (Big appetite) : 0,大 床铺 (Big bed) : 0,大 设备 (Big equipment) : 3,大 食堂 (Big canteen) : 0
没有 真心 (Not true) : 4,干净 厕浴 (Clean toilet bath) : 0,好吃 米 (Delicious rice) : 0,大 花园 (Big garden) : 0,大 库 (Large library) : 0,大 路口 (Big intersection) : 3,大 餐厅 (Big restaurant) : 0
漂亮 前台 (Beautiful) : 4,干净 周围 (Clean around) : 0,好吃 米饭 (Delicious rice) : 0,大 范围 (A wide range of) : 0,大 店面 (Big store) : 0,大 都市 (Metropolis) : 3,大 饭店 (restaurant) : 0
漂亮 庭院 (Pretty courtyard) : 4,干净 周边 (Clean surroundings) : 0,好吃 肉饭 (Delicious pilaf) : 0,大 药 (Big medicine) : 0,大 度假村 (Big resort) : 0,大 食 (Big food) : 3,大 馆 (Large hall) : 0
漂亮 服务员 (Pretty waiter) : 4,干净 品 (Clean product) : 0,好吃 自助餐 (Delicious buffet) : 0,大 药妆 (Big cosmeceutical) : 0,大 异味 (Big smell) : 0,大 食堂 (Big canteen) : 3,大 马 (Malaysia) : 0
漂亮 温泉 (Beautiful hot spring) : 4,干净 国家 (Clean country) : 0,好吃 茶点 (Delicious refreshment) : 0,大 药妆店 (Big drugstore) : 0,大 忙 (Very busy) : 0,好吃 中餐厅 (Delicious chinese restaurant) : 3,大 马路 (Big road) : 0
漂亮 游泳池 (Nice swimming pool) : 4,干净 地方 (Clean place) : 0,好吃 草莓 (Delicious strawberry) : 0,大 药店 (Big pharmacy) : 0,大 态度 (Big attitude) : 0,好吃 做 (Delicious do) : 3,大 鸟 (Big bird) : 0
漂亮 装修 (Beautiful decoration) : 4,干净 地板 (Clean floor) : 0,好吃 菜 (Delicious dish) : 0,大 落地窗 (Large French windows) : 0,大 性价比 (Great value for money) : 0,好吃 冰激凌 (Delicious ice cream) : 3,好吃 三文鱼 (Delicious salmon) : 0
热情 事情 (Passion things) : 4,干净 地段 (Clean location) : 0,好吃 菜品 (Delicious dishes) : 0,大 落差 (Big drop) : 0,大 总体 (Big overall) : 0,好吃 布丁 (Delicious pudding) : 3,好吃 东西 (Delicious stuff) : 0
热情 大叔 (Enthusiasm) : 4,干净 地毯 (Clean carpet) : 0,好吃 虾 (Delicious shrimp) : 0,大 螃蟹 (Big crab) : 0,大 感受 (Great feeling) : 0,好吃 排队 (Delicious) : 3,好吃 中餐厅 (Delicious chinese restaurant) : 0
热情 好客 (Hospitality) : 4,干净 地铁 (Clean subway) : 0,好吃 蛋 (Delicious egg) : 0,大 行 (Daxing) : 0,大 房子 (big house) : 0,好吃 方便面 (Delicious instant noodles) : 3,好吃 丼 (Delicious don) : 0
热情 妹子 (Passionate girl) : 4,干净 地铁站 (Clean subway station) : 0,好吃 蛋糕 (Delicious cake) : 0,大 街 (Big street) : 0,大 手 (big hand) : 0,好吃 水果 (Delicious fruit) : 3,好吃 做 (Delicious do) : 0
热情 接待 (Warm reception) : 4,干净 墙壁 (Clean the walls) : 0,好吃 蜜 (Delicious honey) : 0,大 衣帽间 (Large cloakroom) : 0,大 折扣 (Big discounts) : 0,好吃 牛肉 (Delicious beef) : 3,好吃 冰棍 (Delicious popsicles) : 0
真心 位置 (True position) : 4,干净 墙面 (Clean wall) : 0,好吃 西餐 (Delicious western food) : 0,大 被子 (Big quilt) : 0,大 招牌 (Big signboard) : 0,好吃 甜点 (Delicious dessert) : 3,好吃 冰淇淋 (Delicious ice cream) : 0
老 先生 (Old sir) : 4,干净 客房 (Clean rooms) : 0,好吃 豆 (Delicious beans) : 0,大 装修 (Large decoration) : 0,大 按摩浴缸 (Big jacuzzi) : 0,好吃 菜品 (Delicious dishes) : 3,好吃 冰激凌 (Delicious ice cream) : 0
老 星 (Old star) : 4,干净 室内 (Clean indoor) : 0,好吃 豆腐 (Delicious tofu) : 0,大 设备 (Big equipment) : 0,大 排档 (Food stall) : 0,好吃 虾 (Delicious shrimp) : 3,好吃 卫生 (Delicious and hygienic) : 0
老 爷爷 (Old grandpa) : 4,干净 宾馆 (Clean hotel) : 0,好吃 酒店 (Delicious hotel) : 0,大 设施 (Big facilities) : 0,大 改善 (Big improvement) : 0,好吃 蜜 (Delicious honey) : 3,好吃 吃 (Delicious eat) : 0
老 饭店 (Old hotel) : 4,干净 对面 (Clean opposite) : 0,好吃 附近 (Delicious nearby) : 0,大 话 (Big words) : 0,大 教堂 (Big church) : 0,好吃 附近 (Delicious nearby) : 3,好吃 周围 (Delicious around) : 0
舒服 拖鞋 (Comfortable slippers) : 4,干净 屋子 (Clean house) : 0,好吃 雪糕 (Delicious ice cream) : 0,大 谷 (Otani) : 0,大 整体 (Big overall) : 0,好吃 面 (Delicious noodles) : 3,好吃 周边 (Delicious) : 0
舒服 泡泡澡 (Comfortable bubble bath) : 4,干净 床 (Clean bed) : 0,好吃 面 (Delicious noodles) : 0,大 败笔 (Big failure) : 0,大 斜坡 (Big slope) : 0,好吃 饭菜 (Delicious meal) : 3,好吃 味道 (Delicious taste) : 0
舒服 浴室 (Comfortable bathroom) : 4,干净 床单 (Clean sheets) : 0,好吃 面包 (Delicious bread) : 0,大 路口 (Big intersection) : 0,大 方 (Generous) : 0,好吃 馆 (Delicious restaurant) : 3,好吃 地方 (Delicious place) : 0
舒服 浴缸 (Comfortable bathtub) : 4,干净 床褥 (Clean mattress) : 0,好吃 面包房 (Delicious bakery) : 0,大 车站 (Big station) : 0,大 方便 (Big convenient) : 0,好吃 😋 (Delicious 😋) : 3,好吃 妻 (Delicious wife) : 0
舒服 用品 (Comfortable) : 4,干净 床铺 (Clean bed) : 0,好吃 面馆 (Delicious noodle shop) : 0,大 选择性 (Large selectivity) : 0,大 方面 (Big aspect) : 0,干净 前台 (Clean front desk) : 3,好吃 家 (Delicious) : 0
舒服 睡衣 (Comfortable pajamas) : 4,干净 态度 (Clean attitude) : 0,好吃 食物 (Delicious food) : 0,大 通 (Chase) : 0,大 旁边 (Big beside) : 0,干净 印象 (Clean impression) : 3,好吃 寿司 (Delicious sushi) : 0
舒服 行走 (Comfortable walking) : 4,干净 性价比 (Clean and cost-effective) : 0,好吃 餐 (Delicious meal) : 0,大 通路 (Large access) : 0,大 旅行箱 (Big suitcase) : 0,干净 屋子 (Clean house) : 3,好吃 寿司店 (Delicious sushi restaurant) : 0
近 アメ (Near アメ) : 4,干净 总体 (Clean overall) : 0,好吃 餐厅 (Delicious restaurant) : 0,大 通道 (Large channel) : 0,大 早餐 (Big breakfast) : 0,干净 态度 (Clean attitude) : 3,好吃 小店 (Delicious shop) : 0
近 优势 (Near advantage) : 4,干净 感觉 (Clean feeling) : 0,好吃 餐点 (Delicious meal) : 0,大 遗憾 (Big regret) : 0,大 晚上 (Big night) : 0,干净 浴场 (Clean bath) : 3,好吃 居酒屋 (Delicious izakaya) : 0
近 区 (Near zone) : 4,干净 房 (Clean room) : 0,好吃 餐馆 (Delicious restaurant) : 0,大 部分 (Most part) : 0,大 景区 (Large scenic area) : 0,干净 海水 (Clean sea water) : 3,好吃 巧克力 (Delicious chocolate) : 0
近 场站 (Near field station) : 4,干净 房子 (Clean house) : 0,好吃 饭 (Delicious meal) : 0,大 部队 (Large forces) : 0,大 景色 (Great view) : 0,干净 游泳池 (Clean swimming pool) : 3,好吃 布丁 (Delicious pudding) : 0
近 大学 (Near university) : 4,干净 房屋 (Clean house) : 0,好吃 饭店 (Delicious restaurant) : 0,大 都会 (Metropolis) : 0,大 景观 (Large landscape) : 0,干净 现代 (Clean modern) : 3,好吃 店 (Delicious shop) : 0
近 妆店 (Near makeup shop) : 4,干净 房间 (Clean room) : 0,好吃 饭菜 (Delicious meal) : 0,大 都市 (Metropolis) : 0,大 朋友 (Big friend) : 0,干净 街道 (Clean street) : 3,好吃 房间 (Delicious room) : 0
近 总站 (Near terminus) : 4,干净 打扫 (Clean up) : 0,好吃 馆 (Delicious restaurant) : 0,大 采购 (Big purchase) : 0,大 期待 (Big looking forward) : 0,干净 被褥 (Clean bedding) : 3,好吃 拉面 (Delicious ramen) : 0
近 村 (Near the village) : 4,干净 收拾 (Clean up) : 0,好吃 鸟 (Delicious bird) : 0,大 里面 (Big inside) : 0,大 期望 (Big expectations) : 0,意外 好吃 (Unexpectedly delicious) : 3,好吃 排队 (Delicious) : 0
近 温泉 (Near hot spring) : 4,干净 整体 (Clean overall) : 0,好吃 😋 (Delicious 😋) : 0,大 量 (Large amount) : 0,大 村 (Big village) : 0,新 .... (New...) : 3,好吃 料 (Delicious) : 0
近 狸小路 (Near Tanukikoji) : 4,干净 整理 (Clean up) : 0,干净 一如既往 (Clean as always) : 0,大 金 (Big gold) : 0,大 松本 (Great Matsumoto) : 0,新 中心 (New center) : 3,好吃 料理 (Delicious food) : 0
近 边上 (Near side) : 4,干净 方 (Clean party) : 0,干净 五脏俱全 (Clean and complete) : 0,大 门 (Big gate) : 0,大 枢纽 (Big hub) : 0,新 体验 (New Experience) : 3,好吃 方便面 (Delicious instant noodles) : 0
近 顿觉 (Near suddenly) : 4,干净 方面 (Clean aspect) : 0,干净 人间 (Clean world) : 0,大 门口 (main entrance) : 0,大 柱子 (Big pillar) : 0,新 大堂 (New lobby) : 3,好吃 日餐 (Delicious Japanese food) : 0
远 地段 (Far away) : 4,干净 旁边 (Clean next to) : 0,干净 价格 (Clean price) : 0,大 门脸 (Big door face) : 0,大 标准 (Big standard) : 0,新 宿站 (Shinjuku Station) : 3,好吃 早饭 (Delicious breakfast) : 0
远 城 (Far city) : 4,干净 早餐 (Clean breakfast) : 0,干净 位置 (Clean location) : 0,大 门面 (Large facade) : 0,大 标准间 (Large Standard Room) : 0,新 旧 (New old) : 3,好吃 晚餐 (Delicious dinner) : 0
远 屋 (Far house) : 4,干净 有 (Clean yes) : 0,干净 内部 (Clean interior) : 0,大 问题 (Big problem) : 0,大 标称 (Large nominal) : 0,新 服务 (New service) : 3,好吃 服务 (Delicious service) : 0
远 百货 (Far away) : 4,干净 服务 (Clean service) : 0,干净 前台 (Clean front desk) : 0,大 阳台 (Large balcony) : 0,大 格局 (Big pattern) : 0,新 本 (New) : 3,好吃 材 (Delicious) : 0
远 线 (Far line) : 4,干净 服务员 (Clean waiter) : 0,干净 卫生间 (Clean toilet) : 0,大 附近 (Large nearby) : 0,大 桌子 (Big table) : 0,新 潮 (New trend) : 3,好吃 楼下 (Delicious downstairs) : 0
远 话 (Far away) : 4,干净 条件 (Clean condition) : 0,干净 印象 (Clean impression) : 0,大 雨 (Heavy rain) : 0,大 桥 (Big bridge) : 0,新 程度 (New degree) : 3,好吃 水果 (Delicious fruit) : 0
远 走 (Far away) : 4,干净 枕头 (Clean pillow) : 0,干净 厕所 (Clean toilet) : 0,大 雪 (Heavy snow) : 0,大 楼 (Big building) : 0,新 轮 (New round) : 3,好吃 泡芙 (Delicious puff) : 0
远 超市 (Far supermarket) : 4,干净 档 (Clean file) : 0,干净 厕浴 (Clean toilet bath) : 0,大 风 (Strong wind) : 0,大 楼下 (Big downstairs) : 0,日式 东西 (Japanese style) : 3,好吃 海鲜 (Delicious seafood) : 0
陈旧 感觉 (Stale feeling) : 4,干净 楼下 (Clean downstairs) : 0,干净 周围 (Clean around) : 0,大 风雪 (Heavy snow) : 0,大 欺客 (Big bully) : 0,日式 味道 (Japanese taste) : 3,好吃 火腿 (Delicious ham) : 0
一流 品质 (First-class quality) : 3,干净 毛巾 (Clean towel) : 0,干净 周边 (Clean surroundings) : 0,大 食 (Big food) : 0,大 毛巾 (Big towel) : 0,日式 品种 (Japanese style) : 3,好吃 点心 (Delicious dim sum) : 0
一流 方面 (First-class aspect) : 3,干净 气 (Clean gas) : 0,干净 品 (Clean product) : 0,大 食堂 (Big canteen) : 0,大 毛病 (Big problem) : 0,日式 店 (Japanese shop) : 3,好吃 烧烤 (Delicious barbecue) : 0
一流 景 (First-class view) : 3,干净 水 (Clean water) : 0,干净 国家 (Clean country) : 0,大 餐厅 (Big restaurant) : 0,大 气 (Atmosphere) : 0,日式 标准 (Japanese standard) : 3,好吃 牛 (Delicious cow) : 0
一流 硬件 (First-class hardware) : 3,干净 水准 (Clean standard) : 0,干净 地方 (Clean place) : 0,大 饭店 (restaurant) : 0,大 气味 (Big smell) : 0,日式 浴场 (Japanese style bath) : 3,好吃 牛肉 (Delicious beef) : 0
一般 人 (normal person) : 3,干净 沙滩 (Clean beach) : 0,干净 地板 (Clean floor) : 0,大 馆 (Large hall) : 0,大 水压 (Large water pressure) : 0,日式 浴室 (Japanese style bathroom) : 3,好吃 牛超 (Delicious Niu Chao) : 0
一般 品牌 (General brand) : 3,干净 洗 (Clean wash) : 0,干净 地段 (Clean location) : 0,大 马 (Malaysia) : 0,大 水流 (Big water flow) : 0,日式 温泉 (Japanese hot spring) : 3,好吃 甜点 (Delicious dessert) : 0
一般 床 (Average bed) : 3,干净 洗手间 (Clean toilet) : 0,干净 地毯 (Clean carpet) : 0,大 马路 (Big road) : 0,大 水量 (Large amount of water) : 0,日式 澡堂 (Japanese style bathhouse) : 3,好吃 盖饭 (Delicious rice bowl) : 0
一般 旅馆 (General Hotel) : 3,干净 洗浴 (Clean bath) : 0,干净 地铁 (Clean subway) : 0,大 鸟 (Big bird) : 0,大 江 (Big river) : 0,日式 火锅 (Japanese hot pot) : 3,好吃 米 (Delicious rice) : 0
