hotel_id,comment_id,sentence_num,sentence,emotion_val,date
854,116890,1,They charged us too much for a 2 night stay. We paid more here than the nicer hotels we stayed at in tokyo. It was during a holiday weekend so that maybe explains the prices...however our room was warm and the ac wasn't working. All they told us was to open a window.,0,2017-03-21
456,96400,1,"Hard to find as it is off the Main Street. Needed google maps to locate the property! It is in need of refurbishing as it is quite old fashioned inside. Room very basic, buffet breakfast also very basic.",0,2016-07-18
456,96400,2,Staff helpful at the reception desk.,1,2016-07-18
456,96400,3,Probably would not recommend or stay here again!,0,2016-07-18
44,37851,2,"First of all, let me say that the location is unbeatable. Right in the center of Ginza shopping district and a couple subway stations away from the fish market! The rooms are clean and tidy",1,2012-11-24
44,37851,3,"but VERY small, even by Japanese standards.",0,2012-11-24
44,37851,4,"But the amenities you can find in the room are nice (toiletries, slippers, humidifier, etc...). They even provide a free LAN cable for internet, that worked extremely well.",1,2012-11-24
44,37851,5,"Only issue I had was the AC not properly working. Not sure why that is, but the air does seem to get stuffy and I had to have a window open most of the time.",0,2012-11-24
44,37851,6,"Staff was very helpful and they speak english. All in all, good value hotel to spend a couple nights.",1,2012-11-24
44,37851,7,Do not plan to stay a whole week there though or you might get claustrophobic.,0,2012-11-24
8397,243205,1,In a quiet area but central to a lot of the places we were interested in and to the tram. For us it was within walking distance of central Nagasaki if we didn't want to use the tram. Great breakfast. Friendly and helpful staff.,1,2014-06-03
17228,281560,1,"For such a reasonable price, this hotel is pretty good. The Onsen, free of charge for costumers, is amazing.",1,2017-02-14
17228,281560,2,"The area is nothing special,",0,2017-02-14
17228,281560,3,but it takes No more than 6 min walking from the station. I do recommend it.,1,2017-02-14
19150,287030,1,Recently we traveled to the Tohoku Region with the main intention of riding on the very scenic Gonou Train Line which hugs the coast from Aomori to near Akita.,1,2017-05-20
19150,287030,3,We booked this hotel through JR View and to my surprise and it was a very pleasant surprise it is really quite nice.,1,2017-05-20
19150,287030,4,It is an older 1999 vintage hotel/ryokan built at the end of the Bubble Era,0,2017-05-20
19150,287030,5,"but it has been very well maintained. We had a Japanese style room on the 3rd floor which has an excellent view of the ocean (Japan Sea) from the room, and from the hallway outside of the room a view of the great volcanic mountain which dominates the area. The main bath (Ofuro) was clean, the temperature of the bath properly hot, and there is a view of the sea from both the main bath and the rotenburo outside. Our room was very ample in size, clean and stocked with the standard amenities, free Wi-Fi is available and for those of us without a portable computer there is a computer terminal in the lobby for use by guests. They have a very large gift shop with a good selection of regional specialties in addition to the normal nick knacks. While we were too tired to go down and listen their was a brief 'concert' by a local Shamisen artist in the evening accompanied by a drummer. If you have not heard this three string plucked 'banjo' before it would be worth your while to attend. Dinner was served in the dining room and was generally excellent, the waiter was quite helpful, and food was well prepared and well presented. Breakfast is served buffet style in a large conference/meeting room. It was MORE than adequate in quanity with both Japanese and a good selection of western dishes. Frankly given the remote location, size of the town and age of the hotel I had expected far less than what we got, the price was 17,000 yen per person, mid-week which I thought was quite inexpensive for what we received. I highly recommend a trip on the Gonou LIne to see the coast of Japan, and strongly recommend that after your trip down from Tokyo you stay at this hotel in Ajigasawa before completing your journey the next day. Shuttle service is available from the train station to the hotel and back at no additional charge.",1,2017-05-20
230,78310,1,"We stayed in a standard room for 4 nights, the hotel exceeded our expectations for the price we paid. The room was decent, very clean and the breakfast was spot on. The location of this hotel is fantastic, a 30sec walk out of the shibuya station. The hotel staff were great aswell. Would fully recommend.",1,2017-06-12
16300,278527,1,"This was our third time to Okinawa, so I guess I know what to expect for what I pay.",0,2012-07-01
16300,278527,2,The hotel is located conveniently close to the airport and next to the convention center.,1,2012-07-01
16300,278527,3,"If you are there for business, you may not have too many other options combining that with a resort hotel.",0,2012-07-01
16300,278527,4,It is mostly clean,1,2012-07-01
16300,278527,5,(except some walls on the basement),0,2012-07-01
16300,278527,6,"and the architecture/design is nice. Now, we were staying in one of their nine superior suits (60 square meters) of the main building which appeared to have been renewed quite recently and was adequate in terms of space,",1,2012-07-01
16300,278527,7,"but not well furnished to meet the 400+ USD/night rate we had paid. The working desk was too tiny, even smaller than what you may see in many ordinary hotel rooms. The TV had no major English channels, which was extremely odd, as channels such as CNN or BBC are standard for a hotel of this level in this country. An odd thing about the room was that there was no iron/press in the huge room, and you had to call the front and ask to borrow one. Another big disappointment happened with the room service on one of these expensive days; our room was not serviced until afternoon. We were a couple with a child in the room, but they left only two large bath towels every day. It is not hard to imagine that a family of 3 may need more towels in 24 hrs, so I called them at around 11am and asked for fresh towels. They said OK, but the room service staff came with the towels after more than 3 hours. I already had to take shower and dry up using wet/used towels. Be ware that the front staff and most others were unable to efficiently communicate in English, and that is another disadvantage for a 5 star facility. There was no guard in the parking lot to guide drivers for parking, another substandard point for a big hotel. There was no pool-side bar/restaurant open in late June. The beach in the photos is a public beach quite distant from the hotel, and so the hotel is not a beach resort. In addition, the backdoor way towards the beach is partially unpaved, and therefore it is not suitable for a baby car. The cheering and drum noise from the baseball stadium virtually ruined our relaxation time for a few hours for two days. Some of the spa/pool staff were not as friendly they should have been. The mini bar has no snacks, and even the smallest mineral water bottle is charged at the rate of 315 JPY per bottle.",0,2012-07-01
16300,278527,8,"The restaurants are not bad,",1,2012-07-01
16300,278527,9,"but the dinner is ridiculously expensive. If you have to stay there try the Italian restaurant as the others have little to impress for breakfast. There is no wireless internet in the room, and the reception of the cellular network is rather poor and unstable. Overall, the hotel needs improvement of service and staff training to meet 5 star standards of the day.",0,2012-07-01
5863,228197,1,"This new property has a traditional feel with beautiful gardens. Staff are friendly and helpful and provide a pretty decent breakfast buffet. It's a bit like a 'ryokan-lite' with onsen, yukata and slippers",1,2017-03-27
5863,228197,2,(hint: nothing will fit you). The location isn't good,0,2017-03-27
5863,228197,3,but there is a free shuttle and taxis are cheap.,1,2017-03-27
5863,228197,4,Our room was a bit too small and overheated to be honest. We'd love to be able to open a window.,0,2017-03-27
5863,228197,5,Overall a very nice place,1,2017-03-27
5863,228197,6,but out of the way.,0,2017-03-27
5863,228197,7,Great staff.,1,2017-03-27
5447,224739,1,"Here we got a chance to try a japanese Onsen, as they have three different ones and you are allowed to bath in one per one night you stay. The onsen is reserved only for you for a time, so you can take a bath with your family. We had our best sleep in our trip in Nogamihonkan Ryokan tatami-beds. The hotel room is a pleasant mix of old style Ryokan (tatami mats and beds, low doors) and Western hotel (western toilet). There are small supermarkets, shopping mall and coin laundry nearby. The hotel staff will show them from a map when asked.",1,2015-06-24
11213,256695,1,Our family of five enjoyed our one night stay very much. I liked the location and easy access to the park. This booking included 2 day passes for each of us and that's quite a good value.,1,2015-10-28
11213,256695,2,"I didn't like the fact our car cannot reach the Forest Villa directly. We had to park in the parking lot of the hotel reception and then needed to take all of our own luggage by the free shuttle bus to access the hotel. That was a bit clumsy and difficult. They have free delivery of the luggage, but was a wait of over 2 hours.",0,2015-10-28
11213,256695,3,"We arrived at 4:30pm, so we got to spend a good few hours the first night enjoying the park's night view and lights. It was spectacular and very fun. The Thriller city is quite scary. My kids were freaked out as it was Halloween themed during our visit too. The Art Garden was truly a sight that I will never forget. So beautiful with thousands and thousands of lights to decorate the garden. Stunning. We enjoyed many of the rides and Trick Eye Museum was our favorite. The park closed at 10pm, and we went for late dinner at one of the Izakaya that was near Harbour Town, that closes at midnight. We slept very comfortably in Forest Villa. Luckily we had one of the villas that were closest to the main reception. Not a long walk. I see there are other villas that are quite far away! Wouldn't want to stay in those!",1,2015-10-28
11213,256695,4,"We had a lot of luggage, that was not smart. If you can bring light luggage, it would be much easier to move around in the resort.",0,2015-10-28
11213,256695,5,"Breakfast was buffet. Nice variety. We then used our second day pass to get into the park and finished doing the rest of what we didn't do the night before. The MOST fun was we rented the family bicycle for three hours, and we rode the bicycle around the park as a family. That was very special and each time we got to an attraction, you get to lock the bike, get off, go in the attraction, come back out, and off we went again. My three kids will remember that always as a highlight of our trip this time. Bring your camera as this place is a beautiful place to shoot lots of photos. Forest Villa was a good valued choice.",1,2015-10-28
5834,225784,1,"Very well-located hotel, just steps away from the railway station. The design is eclectic, but quite stylish.",1,2017-07-06
5834,225784,2,"The rooms are small and not very posh in design,",0,2017-07-06
5834,225784,3,"but there are all the amenities one might need (like toothbrushes, razors, sponges, etc). There are also several restaurants, including teppanyaki, which is quite popular. Very convenient place to stay.",1,2017-07-06
9460,247251,1,This was my first onsen stay and I must say I enjoyed every minute of my stay at Miyako! We arrived from Nagoya by bus service provided by the onsen cooperative. The kind lady at Gero Tourist Information Centre rang the hotel for us and we were picked up by the hotel car five minutes later. The hotel was as calm and tranquil as expected. We had a regular room which was very very comfortable for two people.,1,2015-09-10
9460,247251,2,It was a pity that it rained the evening of our stay so we were unable to enjoy the outdoor private bath.,0,2015-09-10
9460,247251,3,The indoor public baths were never busy so we enjoyed soaking there all the same. Dinner was served at fixed times and we chose the last service which was 19:30. The theme for the dishes was 'leaves'. The dishes were pleasing not only to the palette but also to the eye. We slept very well that night! Will definitely go back again.,1,2015-09-10
12529,261574,1,"The sound of the ocean outside our balcony, walking along the boardwalk, our room was incredibly serene, comfortable and meditative. Onsen was EXCELLENT!!! My wife and I were so totally absorbed by our stroll that we totally lost our sense of time, being out for hours without knowing it.",1,2017-03-27
3731,203107,1,"Terrific location with exit to Tanuki-koji Arcade (lots of shops & restaurants). Also close to Odori Station (subway). Very modern rooms, with a restaurant in the hotel building. Free Wi-Fi in lobby. This hotel is an excellent choice for budget-minded travelers who still want modern rooms and excellent service from the hotel staff.",1,2013-07-27
834,106402,1,"My husband and I stayed here using credit card points so I can't speak to value all that much but we felt the hotel was very nice for the points we spent. We had a beautiful view from our room balcony, I was really impressed. The room was clean and the bathroom nice. All the staff that helped us was very nice and helpful. Our credit card gave us a coupon for a free drink so we went to the bar one night and had a drink which was great. There is a subway stop that is a very short walk and a few cafes down the street for breakfast (we did not pay for breakfast at the hotel which was the best choice). The Philosopher's Path is walking distance.",1,2015-08-05
834,106402,2,The only downside is that you are far from the city center and nightlife,0,2015-08-05
834,106402,3,but can easily take the subway there.,1,2015-08-05
834,106402,4,"If you are looking for late night food as we were one night, there is not much around so be prepared for that.",0,2015-08-05
834,106402,5,"We rented bikes one day too which was about $10 more than from the local bike rental places,",0,2015-08-05
834,106402,6,but the convenience was worth it and the bikes were nice. I would definitely stay here again.,1,2015-08-05
333,86644,1,The property is clean and the staff were friendly and helpful.,1,2016-10-23
333,86644,2,"The room was small,",0,2016-10-23
333,86644,3,but roomy enough for 1 person. My room was very clean and modern. The location was close to the train station. I'd stay in the property again.,1,2016-10-23
75,48917,2,"Staff were as polished as you would expect for a hotel in Tokyo: courteous, welcoming and efficient. The room was good and clean and I was particularly impressed by the toiletries selection! Very convenient that it occupies 10 or so floors of a building that also houses many restaurants and shops, so good for a wander or for convenient food choices. Surprisingly the hotel as a fairly impressive cigar bar and a good teppanyaki restaurant.",1,2017-04-30
1332,161559,1,"A difficult location to find as the signage is small,",0,2014-11-11
1332,161559,2,but 5 minute walk from the subway and 20 paces from the ginza.,1,2014-11-11
1332,161559,3,"The room is typically small,",0,2014-11-11
1332,161559,4,but room enough for two.,1,2014-11-11
1332,161559,5,No wireless in the room.,0,2014-11-11
1332,161559,6,"Breakfast is included, but elected to hit one of the numerous bakeries located in the ginza. Great location at an affordable price. Close to many places of interest. BTW, when you travel to Japan, you need not bring any toiletries as so many items can be found in the bathroom besides the normal items: toothpaste & toothbrush, combs, hair bands, moist towelettes, etc.",1,2014-11-11
16613,279269,2,"This is the fourth Dormy I've stayed at, and the room was easily the smallest of the rooms in which I've stayed! The amenities, if you can call them that, were aggressively basic, and there was no sense of style at all. It was just your basic four walls. It was hard for me to move around much, even traveling by myself. I'd like to know where some of these people who said the room was spacious have stayed before.",0,2013-04-11
16613,279269,3,"Now that's the only negative thing I have to say, because otherwise everything was exactly as I expected from a Dormy Inn, from the truly fine baths on the top floor, which included a lovely outdoor bath (exactly the same decor and layout as the one in Kurashiki) to the good location across the street from the major entertainment area of Takamatsu.",1,2013-04-11
16613,279269,5,"but the restaurant looked attractive. The staff all tried their best to be helpful,",1,2013-04-11
16613,279269,6,but the promised English ability was not in evidence the day I was there.,0,2013-04-11
16613,279269,7,"They tried to make a little map that would help me find a restaurant I had heard of,",1,2013-04-11
16613,279269,8,but couldn't do it in any way I could understand.,0,2013-04-11
16613,279269,9,"That turned out to be okay, because I spoke to a very nice lady who pointed out that her udon restaurant was better than the one I'd heard of in 'Lonely Planet.' And she wasn't just bragging. This was a GREAT place, and she and I had nice conversations, her in her broken, but understandable English, me in my broken, but apparently understandable, Japanese. I really enjoyed that place, and enjoyed a nice walk around the extensive arcade areas directly across from the hotel. I had a very good massage treatment in the hotel, and I definitely recommend this service. All in all, it was perfectly acceptable and it is a good choice if you have a limited budget.",1,2013-04-11
3710,200562,2,Beautiful hotel with cozy room. The room was very clean with all the amenities needed. Breakfast was superb with lots of local choices. This hotel is near subway station and is with in walking distance to Sapporo Station.,1,2016-10-09
233,79076,1,"Great location, in Yanaka, not far from Nippori station, thus easily accessible from Narita airport and Tokyo or Ueno train stations. Yanaka is a delightlful neighbourhood, very lively, with plenty of shops and restaurants, very beautiful, with temples and the large cemetery which feels more like a park, and very quiet, with little car traffic, especially at night. Very friendly welcome, the managers speak English and have a good map of the neighbourhood. The modern building, with its austere facade and corridors, is more of a hotel with Japanese style rooms than a traditional ryokan, but the room I had was very nice still, and had an en suite bathroom. Good value for money.",1,2013-04-28
233,79076,2,"Only Western breakfast available,",0,2013-04-28
233,79076,3,"but it was good. Overall this is the perfect place to start a trip to Japan, especially if this is your first trip: fairly easy to find, very comfortable and friendly, and in a neighbourhood you are bound to fall in love with.",1,2013-04-28
3708,200248,1,This is an average business hotel.,0,2015-11-18
3708,200248,2,It is located very close to Sapporo station and to the main attractions of this city. The price is good,1,2015-11-18
3708,200248,3,but rooms are tiny as everything else in Jp. It does need some renovation as it looks old.,0,2015-11-18
203,76116,1,"Reason I chose this place was, first we were 3 of us and normaly hard to find hotel room accomodates 3 or more in same room. I found it from Booking.com for $160.00 w/o breakfast.",1,2015-05-27
203,76116,2,But on the day I arrived they just added one tofal 19090 yen a night...,0,2015-05-27
203,76116,3,"and 2nd, easy access from Narita. Take Keisei skyliner to Nippori with private preassigned seat for 1400yen one way. Hotel is just infront of Nippori station. Lobby is nice and breakfast was good",1,2015-05-27
203,76116,4,"however carpet in hall way at 11th floor need to clean. I mean it smell pretty nasty. Common this is in Japan!. Shame on you guys. It reminded me 1980's a major hotel in Korea, inside of room was nice but their hall way was full of kimchee smell.... Room I saw from web was bit different from actual. On the web there were actual 3 beds and room was a bit roomier however this room just add rollaway bed in the room. If I was not that tired and was staying extra day then I did complaint for miss reading advertisement.",0,2015-05-27
203,76116,5,There are convenient store near hotel and small restaurants. Fastfood restaurant as well.,1,2015-05-27
203,76116,6,"Probably if you go the othersied of station, North exit they may have more things than southside where Lungwood hotel was located.",0,2015-05-27
203,76116,7,Overall not bad place to stay,1,2015-05-27
203,76116,8,"but if you are looking for more action and if you planned ahead of time, go find hotel around Shinagawa station area or Ginza/Shinbashi area. They have more things to do...",0,2015-05-27
1585,166903,2,1) The inter-resort shuttle buses don't start until the 21/12.,0,2014-01-02
1585,166903,3,The hotel owner kindly drove us one way to Happo-one and then we caught a taxi back which works out to be about $30 one way (quick expensive),1,2014-01-02
1585,166903,4,2) Many of the restaurants also don't open until the 21/12,0,2014-01-02
1585,166903,5,"however we were fortunate in that a new restaurant called sushi-katsu was newly opened just around the corner and the food here was divine 3) We had AMAZING snow,",1,2014-01-02
1585,166903,6,but from what I heard we were very lucky and you are hedging your bets going this early in the season.,0,2014-01-02
1585,166903,7,"During the week, the slopes are deserted and skiing is very enjoyable,",1,2014-01-02
1585,166903,8,on the weekends however it feels like 1/2 of Tokyo arrives and I've skiied in many locations around the world at peak time and have never seen a run so busy as was here on the weekend.,0,2014-01-02
1585,166903,9,"Onto the hotel... 1. Service was fantastic. Souza truly went out of his way to arrange lift passes (at a discounted rate), and gave us excellent information on restaurants and other things to do in the area. I can't emphasize enough how much of a difference this made the trip and he really is such an essential person at Mont Blanc (for English speaking guests). Everyone was very friendly though and always trying to help. 2. The room was warm with the heater",1,2014-01-02
1585,166903,10,but I found the hotel itself (breakfast room and corridors) cold - central heating with radiators doesn't seem to exist in Japan so there were often large temperature differences between rooms in the hotel. 3. The rooms are basic,0,2014-01-02
1585,166903,11,but for the price I think reasonable. There wasn't a double bed but two singles which we simply pushed together.,1,2014-01-02
1585,166903,12,The only thing I found uncomfortable were the pillows (very small beanbag type pillows) but got used to them as the week went on!,0,2014-01-02
1585,166903,13,"4. There is a shuttle bus up to Hakuba-goryu from the hotel each morning at 8:30 and returning at 4:30, it is otherwise a 10-15 min walk (wearing ski boots and carrying your skis and poles) and a 5-10 minute walk in normal shoes! 5. The breakfast was tasty",1,2014-01-02
1585,166903,14,but relatively (compared to Europe lodges with huge buffet breakfasts) very small and I would need to be eating at 11am with often a 2nd smaller lunch at 2 or 3 pm with all the skiing you do,0,2014-01-02
1585,166903,15,"but there are many places to eat on the ski fields so this wasn't too much of an issue. Overall I would recommend this hotel for the wonderful service and hospitality, and if you're from Aus and heading to Japan to ski this hotel is a great option.",1,2014-01-02
13663,265394,1,"Really good hotel with courteous and great staff. The private in room bath overlooking the mountain side and crashing waves over the sea is just breathtaking. Food was just amazing, modern French fine dining degustation using local ingredients and Japanese influences.",1,2015-02-18
12085,259036,1,Brilliant Location next to train station and opposite the ferry crossing to start the Shimanami Kaido Cycling Trip.,1,2015-06-05
12085,259036,3,"The hotel is nice, good bar, good breakfast, a Hawaiian restaurant next door!!! (which was really nice) good views of the port,",1,2015-06-05
12085,259036,4,The rooms could do with a lick of paint ours was a no smoking room but smelt a bit stale.,0,2015-06-05
12085,259036,5,Staff very friendly would stay here again. Lovely temple walk with short cable car ride to the top would recommend,1,2015-06-05
6781,234959,1,My husband and I stayed here for our very first ski trip to Hokkaido and were pleasantly surprised at how good this hotel was.,1,2018-01-29
6781,234959,2,"It's location is great - just next to the bus stop to get to the ski resort. The room was clean and spacious and cozy. It helped that the breakfast was good every day to fuel us for a whole day of skiing! The staff were very helpful and cheerful, even though I was a tad grumpy cos I fell sick midway. Would definitely recommend this place to anyone!",1,2018-01-29
