hotel_id,comment_id,sentence_num,sentence,emotion_val,date
24148,292931,3,"Very large King-bedded room with separate Tatami mat area( kids sleep area if required). TV, small fridge etc-Bathroom/separate toilet- modern and well planned. Altogether a very spacious area to relax in though I wasnt in room very much. Public areas are also very large- Bar area was light and bright and there was always interesting snacks there if you had missed a meal or just as extras. Dining room- again- light and bright and spacious. good selection of western/eastern meals. All in all a great place for Singles, Couples and especially families with children of all ages. All staff- on and off snow were great and it was enjoyable sharing meals with different staff members if you wanted. Annex restaurant-Mina Mina offered great Japanese Nabe dinner-need to book",1,2016-03-16
971,132737,2,The hotel is really nice and room is really clean. You also can do self check out at the lobby. I love their SPA amd hot tub and their self laundry service.,1,2016-06-09
2160,179306,2,"(3) If you have tattoos, sorry it's a big NO (can't bath), use the hotel bathroom... :-)",0,2016-01-09
2160,179306,4,"Don't let being naked, scare you away from enjoying one of Japan's nicest experiences. First, no matter what your size or shape, life is too short to be ashamed of your body. Nudity is natural and, for sure, nobody cares what you look like. ALWAYS check what time the Onsen is available, since you might want to take another relaxing dip after dinner.",1,2016-01-09
2160,179306,6,"The room comes with its own toilet which is separated from the shower room. Inside the room is a small fridge, several water glasses, a teapot with instant tea that you can brew, and some welcome cookies. Feel free to bring in any food or drinks from outside, just be sure to clean up your mess such as peelings of fruits if you brought in some. You can simply go and check-in without anything, since the hotel will provide you with a ""yukata"" (its like a bathrobe) that you can wear during your stay, that you can wear even when you eat in their restaurant. We visited this hotel by car, so Im just not quite sure how convenient it is to visit this place using a public transportation. On the other hand, this very relaxing experience was surely worth our time.",1,2016-01-09
3556,197923,1,Having stayed in hotels all over the world I can honestly say that I have never stayed in such a value for money hotel. I would totally recommend it to anyone visiting Nagoya that literally wants a place to stay. The hotel was clean and tidy and staff both polite & friendly.,1,2013-11-30
3556,197923,2,Yes the rooms are very small and basic,0,2013-11-30
3556,197923,3,but taking everything into consideration the price was actually to cheap considering it included breakfast and happy hour drinks. The location is also ideal for Central Nagoya which is only a short walk away.,1,2013-11-30
14819,267592,1,"Turn left at top of station (you'll see shops, restaurants, a Subway sign across the street), go down elevator, turn left and keep walking for 5 - 10 min (or 2 min sprint without luggage :) Some restaurants/cafes near the station. Pros: lovely polite and friendly staff with enough English for most needs. Hotel has a coin operated laundry with dryer in change area of both the male and female public baths.",1,2013-04-14
14819,267592,2,"Cons: rooms are TINY! I understand this for Tokyo, but Gotemba??? There is tonnes of space out there, yet the rooms are so small I had to squish between the two single beds so my husband could walk to his bed furthest from the door. The quilts were also quite dirty. Didn't think to ask for another one - my fault, partly because I didn't use it anyway. The beds were ROCK HARD. Seriously, they were much harder than the futons of our previous ryokan! I bundled up the quilt under the sheets and was barely able to feel any softness at all to sleep. Left me without a blanket so I ramped up the aircon to stay warm. Wasn't game to ask for another (potentially) filthy quilt. I would never stay here again, which is a pity,",0,2013-04-14
14819,267592,3,"because the staff were quite lovely and the laundry convenient. If you're going to the Premium Outlet, the free shuttlebus runs very regularly until near closing time from the right side of the station. There is a bus shelter and a wacky cafe that says something like LOVE CURRY and has a bunch of old cameras in the front window. It was about Y500 for a cup of coffee that tasted like it came from a Nescafe cappuccino packet (although in comparison to an Y800 I paid for a tiny cup of tea in the level 13 cafe at Daimaru in Tokyo, a bargain!).",1,2013-04-14
14819,267592,4,We walked to the outlet - I wouldn't advise this. It took us quite a while,0,2013-04-14
14819,267592,5,"But at some point the road you must follow becomes nearly unwalkable with no footpath and risking a slip into the canal to let cars pass by. It eventually widens out and you have a proper footpath again, but it's a long walk and when you think you are near, the outlet security/traffic staff scattered along the path show you where to walk and you realise you are still quite a ways off. You have to walk through the carpark to get in. Needless to say, we took the bus back to Gotemba station! I would estimate the walk (without lunch) at close to 1hr. It started off quite fast and then slowed down as tiredness and lack of footpath took over.",0,2013-04-14
14819,267592,6,"We caught the train to Fujioka to see the lava cave (quite a trial to find, must write better instructions for interested people) and catch a glimpse of Mt Fuji. We were in the region for 3 days and only managed to catch an eye-straining glimpse of Fuji-san from the lovely small park near Fujioka station.",1,2013-04-14
993,133929,2,"It is a budget hotel, quite basic and old,",0,2013-11-11
993,133929,3,"but location is very good, and price is very reasonable, so overall it has a great value. The hotel staff is very helpful. My good experience with this hotel started well in advance, through email communication, when they helped me to find an option suitable to us. Also, they helped me to make a reservation for a visit to the Moss Temple, and I am very grateful for this. They were very helpful with advise about getting around Kyoto, currency exchange, etc.",1,2013-11-11
993,133929,4,"Buffet is not too exciting,",0,2013-11-11
993,133929,5,"but for $11-12 for breakfast is OK. I will recommend this hotel, and would stay again in it.",1,2013-11-11
9152,246234,1,This small hotel with very friendly (but almost none-English speaking staff) is a good option in this region if you don't want to stay in any of the expensive soviet-style hotels.,1,2015-11-21
9152,246234,2,Rooms a bit dated,0,2015-11-21
9152,246234,3,"but clean and comfortable,",1,2015-11-21
9152,246234,4,wifi not working very well at all times. Breakfast was not really our taste,0,2015-11-21
9152,246234,5,"but there's a 24/7 store across the street. The bbq-restaurant across the street is the best option for diner. In the village is a beautiful waterfall, and a close car- or busride away are all the walks in the national park (we loved the Takochiho no mine walk/climb). The hotel provides tickets and toiletries for the onsen in the village which is nice, including a sauna, but basic. The hotel-owner brought us umbrella's when it started raining while we visited the onsen. So very kind!",1,2015-11-21
425,94029,1,"As we arrived we noticed there was a reception counter for tourists. It was a relief being able to speak fluently with the staff, they were really helpful and arranged everything so we could check out very early. Our room was surprisingly spacious and it had everything we needed.",1,2017-07-11
425,94029,2,The hotel is 20min walk from Shinjuku JR (maybe more carrying luggage),0,2017-07-11
425,94029,3,"but theres an underground passage that connects the station to the -1 hall of the hotel (follow the Metropolitan Gov. Bd. direction). After the second day, we preferred walking north to Tochomae Subway Station (closer and less complex). Shinjuku is a great place to visit and this hotel is a good way to start.",1,2017-07-11
54,40000,1,I selected the hotel because of aome Tripadvisor revies but it was a mistake. The hotel is very expensive and the rooms are tiny. We arrived early in the morning 8.30am and for a 3 hours early check in they asked for more money than for the entire night. Unflexible.,0,2010-04-27
54,40000,2,"Good location, 15 minutes walking to JR station",1,2010-04-27
317,86028,1,"The hotel is easily accessible from Ningyocho (Metro) station, walking distance 2 mins. With the Metro, all parts of Tokyo are reachable within minutes. The location is good with a convenience store nearby and walking distance to Mitsukoshi, an old flagship store which sells mainly female wear. Good and reasonably priced food like ramen and curry rice are just around the corner. I had a single non smoking room. It was devoid of smoke smell.",1,2013-11-06
317,86028,2,The room is expectedly small and the walkway inside the room was the only place I could place (and open) my oversized luggage. I reckon that business travellers with their carry-ons will have lesser problems.,0,2013-11-06
317,86028,3,"The hanger is a recess in the wall - which can fit a couple of business suits comfortably. The bath is clean and everything works perfectly. The room is cleaned daily without fuss, the sheets are clean. Daily nightgowns were provided in packed hygienic condition.",1,2013-11-06
317,86028,4,Only green tea sachets were provided - coffee would have been nice.,0,2013-11-06
317,86028,5,"There's a hairdryer, fridge, water kettle (for instant noodles), small TV, dimmer-able lights, air-con. The environment is quiet at night. I particularly liked the 'bean?' filled head pillows which worked very well for my neck. Free bath amenities - bath salts, face mask, mouthwash, shaving gel are available at the lobby to pick up. Skewers dinner in the basement restaurant were delicious and worth a try. Will definitely consider if I am returning to Tokyo alone. Did not try a bigger room but I guess they should be family friendly. Finally, good friendly service at the front counter.",1,2013-11-06
24152,293386,2,"well, i should admit its a pricey ski resort.",0,2016-04-01
24152,293386,3,"however, i also should admit, its worth the price though. you can play with snow at most place in hokkaido, but you can only get the experience of Ice village(great place to stroll in the middle of snow at night), mina-mina beach(summer beach pool sensation in the middle of snow), and surely kirin no yu(outdoor onsen with sensation of white snow scenery in front of your eyes while the snow is falling above you). we, family of 4, stay in 4-beds room, with 2 bathrooms . my daughters love the mina-mina beach and kirin no yu, especially ice sliding in ice village. definitely will recommend this place for winter vacation",1,2016-04-01
3706,200065,1,Ask for a view of the park out your window. It's a great location for walking around and a brisk 10min walk up the Main Street until your surrounded by restaurants. Beautiful breakfast downstairs and big lobby area. The club room on the 10th floor is great as it has a lounge to relax with tea or coffee and much nicer bedrooms. The amenities are beautiful too.,1,2016-10-21
838,108869,1,"Stepping into the entrance lobby it was apparent this hotel was in a different league from the other Tokyu hotels we stayed at in Japan. Elegant floral displays, a water feature and a spacious lobby made a good first impression. And at last a decent size room. Spacious, an air conditioning system which worked, and space to store clothes. All features other Tokyu hotels failed to provide. For that reason it deserves five stars.",1,2015-04-03
838,108869,2,"Yes the location is not good,",0,2015-04-03
838,108869,3,but do make use of the efficient hotel shuttle bus.,1,2015-04-03
838,108869,4,And breakfast was not brilliant.,0,2015-04-03
838,108869,5,But hey! a decent room at last.,1,2015-04-03
244,79688,1,"'Beggars can't be choosers', they said.",0,2015-06-30
244,79688,3,It's every sense a budget hotel - the rooms are just... adequate. The cleanliness... decent (tables were a little sticky).,0,2015-06-30
244,79688,4,"The staff could speak English, so that's a big tick. The rooms are spacious, which is nice,",1,2015-06-30
244,79688,5,"but the bed was frustratingly small. They claimed it was a double bed... but my wife and I often found ourselves playing Midnight Mortal Kombat throughout the night. So, enough with the negative.",0,2015-06-30
244,79688,6,"Why is it deserving of 4 stars? The location is pretty great - there are two nearby stations around 5-10 mins walk from the hotel (easily accessible from the airport), it's located near some nice restaurants and you could even walk 25-30 mins to some tourist sites if you're one of those out-and-about, super-fit types. The hotel even provides a washing room for those who want to travel light and take less clothes. The free wifi is also a plus, and",1,2015-06-30
244,79688,7,"despite having to check out at 9am,",0,2015-06-30
244,79688,8,you can leave your luggage at the hotel until you need to head out. The staff are friendly and,1,2015-06-30
244,79688,9,"despite sticky tables,",0,2015-06-30
244,79688,10,"the floors were clean, the bedsheets were decent and the bathroom (thankfully) spotless. You go to Japan to spend money on buying local food, perhaps some anime figurines/games if you're into that sort of thing, not on hotels. This hotel is the ultimate budget hotel. It does its job so that you can immerse yourself in the alien country that is Japan. Recommended.",1,2015-06-30
16302,278541,1,"One of the nicest places I've stayed while in Okinawa. The suites are very spacious and extremely clean. Like, so clean, you feel ashamed at what you used to consider clean. The location isn't too far from Naha and not too far from Kadeena AFB either. Roughly two blocks north of the property is a place called Round One, and its a video game/entertainment heaven. Additionally there are plenty of places to eat all near the hotel. The staff are extremely courteous and, for the most part, they all speak English to some extent; some fluently. You will NOT go wrong staying here. Ive stayed here twice, first 1st time for well over a month, and the second for roughly a month. Loved every second of my stay there.",1,2017-06-03
1529,166661,1,"What I like:- 1. The location - next to JR station. If u hold a JR pass, its like 5 min walk from the station only. 2. Many shopping malls - the AEON mall is super big and u hv everything in Japan to buy. 3. The bfast - is good. 4. They hv a common area at the lobby with chairs/ tables, and u can buy food from the malls and enjoy there. Microwax & hot water is all avail. Its great for grp of frens or family to sit around. What I din like:- 1. None",1,2018-01-03
1333,161746,2,The Richmond is adjacent to the Pacinko & Slot place. The hotel is efficient and the staff are cordial,1,2015-05-28
1333,161746,3,but lack warmth.,0,2015-05-28
1333,161746,4,This was the third time we had stayed at a Richmond Hotel. A few days ago we stayed in Kochi at the Richmond and it was very good.,1,2015-05-28
1333,161746,5,"However, at this hotel we were not offered the little extras at check in time. That is the bath bombs, hand cream, shave conditioner and body milk. When I asked they were reluctant to give me three days worth of goodies. The room was small",0,2015-05-28
1333,161746,6,but adequate,1,2015-05-28
1333,161746,7,but there was nowhere out of the way to leave our luggage.,0,2015-05-28
1333,161746,8,The bathroom was large with a seperate toilet which was good. Very large tv which we did not watch as we do not understand Japanese.,1,2015-05-28
1333,161746,9,Unfortunately channels like CNN were all dubbed with Japanese.,0,2015-05-28
1333,161746,11,The internet connectivity was excellent. Lots of great places to eat nearby. The receptionist will give you a map outlining the restaurants etc. It is a good 15 minute walk into Namba. There is a very good laundry within this hotel. Costs 200 yen for an wash and 100 Yen to dry. The beds were very comfortable.,1,2015-05-28
5138,223015,1,Booked for location and looking for a traditional Japanese style room... Which is was.,1,2015-12-05
5138,223015,2,"However, it advertised wifi where there was none, doors are locked up at 12 and aren't opened again until owners wake up, and hot water was non existent. Also, be prepared to communicate in Japanese or gesture because they do not speak a word of English,",0,2015-12-05
5138,223015,3,though they were lovely.,1,2015-12-05
17395,284026,1,We chose this hotel for its location. We had booked tickets for the two Disney parks in Tokyo - Tokyo DisneySea and Tokyo Disneyland and the hotel was about a ten minute walk away from Tokyo DisneySea which suited us perfectly.,1,2015-10-04
17395,284026,2,We were welcomed to the hotel by reception staff and payment for the room was to be dealt with on arrival which proved a bit difficult as my MasterCard was not acceptable.,0,2015-10-04
17395,284026,3,Fortunately my Visa card was accepted so it worked out okay in the end! Visa or cash is the preferred method of payment here in Tokyo. Our room was on the 5th floor and was clean and comfortable.,1,2015-10-04
17395,284026,4,It felt a little bit cramped with three beds and only a very small bathroom,0,2015-10-04
17395,284026,5,"but was ideal for our purposes. As we spent most of our time in the parks we didn't actually spend much time in the hotel. Useful to note there is a convenience store about five minutes away from the hotel which proved to be quite handy for us. Opposite the hotel is a big car park and if you wander over there (it's not too far) you are in a shopping mall called Ikspiari which is huge and has a food court, supermarket, Disney store etc. You can easily catch the Disney monorail from here too which was a fantastic service and frequent too. It is also possible to catch trains direct in to Tokyo from here at the train station - just follow the signs. A fantastic location for us and we would definitely return to this hotel. Thanks for having us.",1,2015-10-04
5098,222496,1,"This hotel is almost brand new. Rooms are very clean and functional with shower in each one and western style toilet. Location is very convinient, 5 minutes from train station & around 15 from downtown.",1,2017-04-10
964,132454,1,Very good for relaxing and so comfortable. Hotel service is also nice too. Full-boards are delicious and have variety kind of Kaiseki japanese food. All are quite suitable for room price. We can see the nature view from Onsen room. can,1,2016-11-13
35,33462,1,"I read a few reviews of this place before my recent trip and figured it would be pretty good. Turns out it was better than that! First, I had read that it was 'kind of far' from the station. If you consider a 5 block walk up a very slight incline through a very nice neighborhood, then you are either older than I am, or you love being in a resort - which this is not. The walk was easy even in 85-90 degree heat. Plus, you are a two block walk from Yoyogi park. Nice. The front desk was helpful and spoke decent english. The lobby was clean with computers with internet access (1$=10 min.)...might have had wi-fi too.",1,2013-07-29
35,33462,2,Did not try the restaurants,0,2013-07-29
35,33462,3,- but food looked decent.,1,2013-07-29
35,33462,4,Only reason not to give 5stars was that the beds were a bit too hard for my liking...as in VERY hard. I hear this is the japanese way though so it may be similar wherever you stay. There was construction next door,0,2013-07-29
35,33462,5,"but we never heard it. Loved the Shibuya neighborhood...better than Roppongi or Shinjuku for sure. Lots of food, shopping, fun, beautiful women and a great hub for getting around. Add in that it ranged form $115 to $150 USD per night, and you can't go wrong.",1,2013-07-29
2219,180381,1,The room was cozy with a hot bath in th2 balcony facing thw greens. Breakfast was a great,1,2017-10-01
2219,180381,2,though eating rice and salmon at 9:00 isn't something I'd do at home.,0,2017-10-01
2219,180381,3,Thw Restaurant Maissen 300m was an amazimg place to eat dinner (Italian). Overall for a one night stay in the Hakone circular trip - it is a great choice,1,2017-10-01
3893,208290,1,"You can choose at this place to have a Western or a Japanese room. I would urge you to try the latter. This hotel knows what service is. From the moment you are welcomed, you are looked after. Your room has a small entrance where you remove your shoes, and then you will step up into your bedroom/living room. A small low table and two chairs are there, but while you are enjoying dinner, these are replaced by your futons. It is assumed you will bathe in the onsen on the top floor, so do not expect too much of your bathroom. The dinner is all inclusive and is very Japanese with delicacies, pickles, mouthwatering beef, fish, local apple wine, matcha, and of course you will wear your yukata so you can get into it properly ! The futons were extremely comfortable and we had a very good nights sleep. Breakfast is also Japanese style so expect more raw fish, soup, salad - just be brave and attempt a little out of every dish in front of you. When you are ready to leave, a taxi is summoned and you are waved off by the whole staff and made to feel so special. We came to this hotel to visit the snow monkeys, but it was one of the best we stayed in for service, value and food. Please give it a try.",1,2016-05-28
1074,135084,2,It was devastating. Walls in the room were stained. The room itself was dusty and obviously dirty. There is a'smoking area' at the entrance so you smell smoke everywhere. Biggest negative: Mold in the shower.,0,2016-05-28
45,38024,1,"Very close to Nishikasai eki and walking distance to most amenities like restaurant and grocery shops. Half an hour away from Tokyo city with frequent train service Very good staff,",1,2015-09-15
45,38024,2,"however, English proficiency needs to be improved",0,2015-09-15
17406,284301,1,I will stay at this hotel whenever visit to Disneyland Tokyo. This hotel is just in front of Disneyland fews minutes walk only. Location is Convenient and the hotel room is clean,1,2018-01-29
17406,284301,2,although a bit run down.,0,2018-01-29
23135,292154,1,Non- Japanese will find that communication with staff might be slightly problematic,0,2017-05-02
23135,292154,2,but The lead matron was friendly and service from staff was great. We were able to hear crickets and frogs at night with the gushing river right in front of us . Dinner (served to your room) and breakfast (at the common hall) were awesome.,1,2017-05-02
23135,292154,3,Not the prettiest presentation,0,2017-05-02
23135,292154,4,but full of flavor. Give this place a try and oh if you have budget - pay for the private onsen.,1,2017-05-02
23135,292154,5,And ask for 4pm pick up as after you checked in there is nothing in the surroundings for you to roam around.,0,2017-05-02
23135,292154,6,They provide shuttle bus back to the station at 10:10am (check out is 10am),1,2017-05-02
8183,240262,2,"Room: 4/5, Onsen: 4/5, Staff: 4/5, Location: 4/5",1,2016-12-20
8183,240262,6,"That said, it Wakasa Bettei had been a great introduction to the Japanese ryonkan experience. Our room (303) was very spacious and clean. It has a small bathroom and outdoor hot tub, which we didn't use as we preferred the larger public onsen. There are 2 of those - one in the main wing (New Wakasa Hotel), which opens during the day; and another on the 4th floor of where we were at. In fact, we just needed to climb a flight of stairs to access it.",1,2016-12-20
8183,240262,7,"The hotel appears to have aged a little, and the decor is a strange combination of faux-Art Noveau and modern Japanese styles.",0,2016-12-20
8183,240262,8,"But that is quickly overlooked by the room we got and of course, the staff on hand, who were courteous and helpful without being intrusive. The breakfast, while hearty and artfully arranged,",1,2016-12-20
8183,240262,9,was so-so at best.,0,2016-12-20
8183,240262,10,"We did not take the dinner option, as there are plenty of restaurants to check out. Location-wise, it is about a 10 to 12 minute walk from major attractions. There is a walking map provided and we spent an entire day doing just that, and coming back to a hot soak after a great dinner will just about cap our experience in Nara.",1,2016-12-20
393,90289,2,"the location was excellent as it is by the train station and metro with direct line to Narita. compared to other hotels we have stayed in japan, it offers great value for your money.",1,2016-10-23
6777,234879,1,"Terrific apartment - we stayed in Yama Shizen West apt 602. Each room had a king bed with its own bathroom and tv and access to the balcony. The jacuzzi on the balcony was amazing, great to sit in there at the end of the day relaxing taking in the awesome view of Mt Youtei. Free wifi, great stereo, dvd with usb port ( just attached my ipad and could watch my downloaded movies) although there is free dvd rental at reception. The apartment is super modern and extremely clean throughout and very spacious. We were very happy with the choice. The best part was the free ski valet service Hokkaido travel offers - no need to cart your skis and those horrible boots back and forth from the ski fields, just leave them there near the Gondola lift with the valet and catch the bus for a 2 min ride back to your hotel. Great idea! I have never seen so much soft snow! incredible white christmas!",1,2013-01-09
2939,186825,1,"Despite the high cost of staying at Kamokochi,",0,2015-12-27
